seasonType,eventId,commentaryOrder,playId,clockDisplayValue,commentaryText,updateDateTime
13099,726544,11,44954316,87',Tyler Pasnik (FC Naples) Yellow Card at 87',2025-03-30 04:56:45
13099,726545,0,44953514,4',Brandon Mcmanus (Texoma FC) Goal at 4',2025-03-30 04:56:45
13099,726545,1,44953939,31',Conor McGlynn (Westchester SC) Goal at 31',2025-03-30 04:56:45
13099,726545,2,44954264,44',Ozzie Ramos (Texoma FC) Substitution at 44',2025-03-30 04:56:45
13099,726545,3,44954385,45'+5',Oluwatobilba Adewole (Westchester SC) Yellow Card at 50',2025-03-30 04:56:45
13099,726545,4,44954814,48',Oluwatobilba Adewole (Westchester SC) Goal at 48',2025-03-30 04:56:45
13099,726545,5,44954965,55',Sergio Chavez (Texoma FC) Yellow Card at 55',2025-03-30 04:56:45
13099,726545,6,44955106,62',Daniel Bouman (Westchester SC) Substitution at 62',2025-03-30 04:56:45
13099,726545,7,44955107,62',Rashid Tetteh (Westchester SC) Substitution at 62',2025-03-30 04:56:45
13099,726545,8,44955191,66',Mason Mccready (Texoma FC) Yellow Card at 66',2025-03-30 04:56:45
13099,726545,9,44955265,71',Prince Saydee (Westchester SC) Substitution at 71',2025-03-30 04:56:45
13099,726545,10,44955343,79',Prince Saydee (Westchester SC) Yellow Card at 79',2025-03-30 04:56:45
13099,726545,11,44955369,81',Ozzie Ramos (Texoma FC) Yellow Card at 81',2025-03-30 04:56:45
13099,726545,12,44955386,83',Philip Spengler (Texoma FC) Yellow Card at 83',2025-03-30 04:56:45
13099,726545,13,44955408,84',Reid Valentine (Texoma FC) Substitution at 84',2025-03-30 04:56:45
13099,726545,14,44955412,84',Donald Benamna (Texoma FC) Substitution at 84',2025-03-30 04:56:45
13099,726545,15,44955409,85',Jonathan Bolanos (Westchester SC) Goal at 85',2025-03-30 04:56:45
13099,726545,16,44955432,86',Jonathan Bolanos (Westchester SC) Yellow Card at 86',2025-03-30 04:56:45
13099,726545,17,44955470,87',Ermin Mackic (Westchester SC) Substitution at 87',2025-03-30 04:56:45
13099,726545,18,44955471,87',Mink Peeters (Westchester SC) Substitution at 87',2025-03-30 04:56:45
13099,726545,19,44955520,90'+4',Philip Spengler (Texoma FC) Red Card at 94',2025-03-30 04:56:45
13099,726546,0,45003426,10',Aaron Walker (South Georgia Tormenta FC) Substitution at 10',2025-04-06 04:57:44
13099,726546,1,45003711,36',Gabriel Cabral (South Georgia Tormenta FC) Yellow Card at 36',2025-04-06 04:57:44
13099,726546,2,45003752,38',Michael Knapp (Chattanooga Red Wolves) Yellow Card at 38',2025-04-06 04:57:44
13099,726546,3,45004226,48',Jackson Kasanze (South Georgia Tormenta FC) Yellow Card at 48',2025-04-06 04:57:44
13099,726546,4,45004287,52',Mason Tunbridge (South Georgia Tormenta FC) Penalty - Scored at 52',2025-04-06 04:57:44
13099,726546,5,45004417,60',Omar Hernandez (Chattanooga Red Wolves) Penalty - Scored at 60',2025-04-06 04:57:44
13099,726546,6,45004468,61',Matthew Bentley (Chattanooga Red Wolves) Substitution at 61',2025-04-06 04:57:44
13099,726546,7,45004469,61',Jordan Ayimbila (Chattanooga Red Wolves) Substitution at 61',2025-04-06 04:57:44
13099,726546,8,45004470,61',Sebastián Vivas (South Georgia Tormenta FC) Substitution at 61',2025-04-06 04:57:44
13099,726546,9,45004471,63',Mason Tunbridge (South Georgia Tormenta FC) Yellow Card at 63',2025-04-06 04:57:44
13099,726546,10,45004582,72',Alhassan (Chattanooga Red Wolves) Substitution at 72',2025-04-06 04:57:44
13099,726546,11,45004583,72',Omar Gómez (Chattanooga Red Wolves) Substitution at 72',2025-04-06 04:57:44
13099,726546,12,45004630,75',Conor Doyle (South Georgia Tormenta FC) Substitution at 75',2025-04-06 04:57:44
13099,726546,13,45004631,75',Joseph Pérez (South Georgia Tormenta FC) Substitution at 75',2025-04-06 04:57:44
13099,726546,14,45004632,77',Sebastián Vivas (South Georgia Tormenta FC) Goal at 77',2025-04-06 04:57:44
13099,726546,15,45004822,84',Jonathan Filipe (Chattanooga Red Wolves) Substitution at 84',2025-04-06 04:57:44
13099,726546,16,45004851,88',Matthew Bentley (Chattanooga Red Wolves) Penalty - Scored at 88',2025-04-06 04:57:44
13099,726547,0,45004489,30',Karsen Henderlong (FC Naples) Goal at 30',2025-04-06 04:57:44
13099,726547,1,45004587,37',Preston Kilwien (Texoma FC) Yellow Card at 37',2025-04-06 04:57:44
13099,726547,2,45004706,44',Sergio Chavez (Texoma FC) Yellow Card at 44',2025-04-06 04:57:44
13099,726547,3,45004760,45'+2',Solomon Asanté (Texoma FC) Yellow Card at 47',2025-04-06 04:57:44
13099,726547,4,45005183,45',Teddy Baker (Texoma FC) Substitution at 45',2025-04-06 04:57:44
13099,726547,5,45005325,53',Brecc Evans (FC Naples) Goal at 53',2025-04-06 04:57:44
13099,726547,6,45005442,57',Julian Cisneros (FC Naples) Yellow Card at 57',2025-04-06 04:57:44
13099,726547,7,45005573,63',Patrick Staszewski (Texoma FC) Substitution at 63',2025-04-06 04:57:44
13099,726547,8,45005629,65',Marc Torrellas (FC Naples) Yellow Card at 65',2025-04-06 04:57:44
13099,726547,9,45005731,71',Ozzie Ramos (Texoma FC) Yellow Card at 71',2025-04-06 04:57:44
13099,726547,10,45005757,72',Kevin O'Connor (FC Naples) Substitution at 72',2025-04-06 04:57:44
13099,726547,11,45005840,78',Donald Benamna (Texoma FC) Substitution at 78',2025-04-06 04:57:44
13099,726547,12,45005924,80',Jon Paul Jordan Ii (Texoma FC) Yellow Card at 80',2025-04-06 04:57:44
13099,726547,13,45005925,82',Gustavo Fernandes (FC Naples) Substitution at 82',2025-04-06 04:57:44
13099,726547,14,45005926,82',Tyler Pasnik (FC Naples) Substitution at 82',2025-04-06 04:57:44
13099,726547,15,45005999,88',Jake Dengler (FC Naples) Goal at 88',2025-04-06 04:57:44
13099,726547,16,45006059,90'+2',Rodolfo Sulia (FC Naples) Substitution at 92',2025-04-06 04:57:44
13099,726547,17,45006060,90'+2',Roscoe Rubinstein (FC Naples) Substitution at 92',2025-04-06 04:57:44
13099,726548,0,45003565,23',Zane Bubb (Greenville Triumph) Yellow Card at 23',2025-04-06 04:57:44
13099,726548,1,45003604,28',Luis Alvarez (Charlotte Independence) Yellow Card at 28',2025-04-06 04:57:44
13099,726548,2,45004275,56',Tyler Polak (Greenville Triumph) Yellow Card at 56',2025-04-06 04:57:44
13099,726548,3,45004387,62',Rodrigo Robles (Greenville Triumph) Substitution at 62',2025-04-06 04:57:44
13099,726548,4,45004388,63',Omar Ciss (Charlotte Independence) Substitution at 63',2025-04-06 04:57:44
13099,726548,5,45004389,64',Souaibou Marou (Charlotte Independence) Substitution at 64',2025-04-06 04:57:44
13099,726548,6,45004390,64',Pele Ousmanou (Charlotte Independence) Substitution at 64',2025-04-06 04:57:44
13099,726548,7,45004552,77',Ben Zakowski (Greenville Triumph) Substitution at 77',2025-04-06 04:57:44
13099,726548,8,45004553,77',Anton Sorenson (Charlotte Independence) Substitution at 77',2025-04-06 04:57:44
13099,726548,9,45004662,85',Christopher Jaime (Charlotte Independence) Substitution at 85',2025-04-06 04:57:44
13099,726548,10,45004663,86',Leonardo Castro (Greenville Triumph) Goal at 86',2025-04-06 04:57:44
13099,726548,11,45004710,87',Carlos Anguiano (Greenville Triumph) Substitution at 87',2025-04-06 04:57:44
13099,726548,12,45004711,88',Sebastián Velásquez (Greenville Triumph) Substitution at 88',2025-04-06 04:57:44
13099,726549,0,45006485,9',Emmanuel Alaribe (AV Alta FC) Goal at 9',2025-04-07 04:59:19
13099,726549,1,45006576,15',Eduardo Blancas (AV Alta FC) Yellow Card at 15',2025-04-07 04:59:19
13099,726549,2,45006713,27',Jimmie Villalobos (AV Alta FC) Goal at 27',2025-04-07 04:59:19
13099,726549,3,45006854,43',Osvaldo Lay (AV Alta FC) Yellow Card at 43',2025-04-07 04:59:19
13099,726549,4,45006855,44',Sebastian Cruz (AV Alta FC) Yellow Card at 44',2025-04-07 04:59:19
13099,726549,5,45007038,60',Prince Saydee (Westchester SC) Substitution at 60',2025-04-07 04:59:19
13099,726549,6,45007067,68',Joaquin Acuna (AV Alta FC) Substitution at 68',2025-04-07 04:59:19
13099,726549,7,45007075,72',Mink Peeters (Westchester SC) Substitution at 72',2025-04-07 04:59:19
13099,726549,8,45007092,72',Koen Blommestijn (Westchester SC) Substitution at 72',2025-04-07 04:59:19
13099,726549,9,45007093,73',Miguel Pajaro (AV Alta FC) Yellow Card at 73',2025-04-07 04:59:19
13099,726549,10,45007103,76',Koen Blommestijn (Westchester SC) Yellow Card at 76',2025-04-07 04:59:19
13099,726549,11,45007104,77',Ashkanov Apollon (AV Alta FC) Substitution at 77',2025-04-07 04:59:19
13099,726549,12,45007108,82',Juan Carlos Obregón Jr (Westchester SC) Yellow Card at 82',2025-04-07 04:59:19
13099,726549,13,45007129,84',Joaquin Acuna (AV Alta FC) Yellow Card at 84',2025-04-07 04:59:19
13099,726549,14,45007130,84',Erick Ceja (AV Alta FC) Substitution at 84',2025-04-07 04:59:19
13099,726549,15,45007131,85',Miguel Ibarra (AV Alta FC) Substitution at 85',2025-04-07 04:59:19
13099,726549,16,45007138,87',Ermin Mackic (Westchester SC) Substitution at 87',2025-04-07 04:59:19
13099,726550,0,45005922,39',Mikey Lopez (Portland Hearts of Pine) Yellow Card at 39',2025-04-06 04:57:44
13099,726550,1,45006024,45'+1',Anuar Peláez (Spokane Velocity FC) Yellow Card at 46',2025-04-06 04:57:44
13099,726550,2,45006292,58',Michel Poon-Angeron (Portland Hearts of Pine) Yellow Card at 58',2025-04-06 04:57:44
13099,726550,3,45006341,63',Patrick Langlois (Portland Hearts of Pine) Substitution at 63',2025-04-06 04:57:44
13099,726550,4,45006342,63',Ollie Wright (Portland Hearts of Pine) Substitution at 63',2025-04-06 04:57:44
13099,726550,5,45006424,72',Titus Washington (Portland Hearts of Pine) Substitution at 72',2025-04-06 04:57:44
13099,726550,6,45006482,78',Nil Vinyals (Spokane Velocity FC) Substitution at 78',2025-04-06 04:57:44
13099,726550,7,45006483,78',Jack Denton (Spokane Velocity FC) Substitution at 78',2025-04-06 04:57:44
13099,726550,8,45006484,78',Ismaila Jome (Spokane Velocity FC) Substitution at 78',2025-04-06 04:57:44
13099,726550,9,45006613,89',Shandon Wright (Portland Hearts of Pine) Yellow Card at 89',2025-04-06 04:57:44
13099,726550,10,45006648,90',Mark Hernández (Spokane Velocity FC) Substitution at 90',2025-04-06 04:57:44
13099,726550,11,45006649,90'+2',Jake Keegan (Portland Hearts of Pine) Substitution at 92',2025-04-06 04:57:44
13099,726551,0,45031040,11',Brent Kallman (Union Omaha) Yellow Card at 11',2025-04-10 05:14:27
13099,726551,1,45031522,45',Joe Gallardo (Union Omaha) Substitution at 45',2025-04-10 05:14:27
13099,726551,2,45031556,58',Guilherme França (Richmond Kickers) Yellow Card at 58',2025-04-10 05:14:27
13099,726551,3,45031605,66',Mark Bronnik (Union Omaha) Substitution at 66',2025-04-10 05:14:27
13099,726551,4,45031648,67',Emiliano Terzaghi (Richmond Kickers) Substitution at 67',2025-04-10 05:14:27
13099,726551,5,45031649,68',Adrian Billhardt (Richmond Kickers) Substitution at 68',2025-04-10 05:14:27
13099,726551,6,45031916,77',Hayden Anderson (Richmond Kickers) Substitution at 77',2025-04-10 05:14:27
13099,726551,7,45031797,78',Mark Bronnik (Union Omaha) Yellow Card at 78',2025-04-10 05:14:27
13099,726551,8,45031828,82',Darwin Espinal (Richmond Kickers) Goal at 82',2025-04-10 05:14:27
13099,726551,9,45031869,84',Kemy Amiche (Union Omaha) Substitution at 84',2025-04-10 05:14:27
13099,726551,10,45031870,85',Jonathan Kanagwa (Richmond Kickers) Substitution at 85',2025-04-10 05:14:27
13099,726551,11,45031917,87',Hayden Anderson (Richmond Kickers) Yellow Card at 87',2025-04-10 05:14:27
13099,726551,12,45031918,88',James Vaughan (Richmond Kickers) Yellow Card at 88',2025-04-10 05:14:27
13099,726552,0,45030989,5',Jaheim Brown (One Knoxville) Yellow Card at 5',2025-04-17 04:56:06
13099,726552,1,45031000,7',Leonardo Castro (Greenville Triumph) Yellow Card at 7',2025-04-10 05:14:27
13099,726552,2,45031315,27',Sebastián Velásquez (Greenville Triumph) Substitution at 27',2025-04-10 05:14:27
13099,726552,3,45031397,37',Mark Doyle (One Knoxville) Goal at 37',2025-04-10 05:14:27
13099,726552,4,45031513,45'+6',Stavros Zarokostas (One Knoxville) Yellow Card at 51',2025-04-10 05:14:27
13099,726552,5,45031557,57',Kimarni Smith (One Knoxville) Substitution at 57',2025-04-10 05:14:27
13099,726552,6,45031558,57',Sivert Haugli (One Knoxville) Substitution at 57',2025-04-10 05:14:27
13099,726552,7,45031627,65',Sivert Haugli (One Knoxville) Yellow Card at 65',2025-04-10 05:14:27
13099,726552,8,45031628,67',Ben Zakowski (Greenville Triumph) Substitution at 67',2025-04-10 05:14:27
13099,726552,9,45031673,67',Kimarni Smith (One Knoxville) Yellow Card at 67',2025-04-10 05:14:27
13099,726552,10,45031783,77',Angelo Kelly-Rosales (One Knoxville) Substitution at 77',2025-04-10 05:14:27
13099,726552,11,45031784,77',Babacar Diene (One Knoxville) Substitution at 77',2025-04-10 05:14:27
13099,726552,12,45031839,81',Scott Mcleod (One Knoxville) Substitution at 81',2025-04-10 05:14:27
13099,726552,13,45031895,85',Ivan Agyaakwah (Greenville Triumph) Substitution at 85',2025-04-10 05:14:27
13099,726552,14,45031945,88',Zane Bubb (Greenville Triumph) Yellow Card at 88',2025-04-10 05:14:27
13099,726552,15,45031966,90'+1',Louis Herrera (Greenville Triumph) Red Card at 91',2025-04-10 05:14:27
13099,726552,16,45032017,90'+4',Angelo Kelly-Rosales (One Knoxville) Yellow Card at 94',2025-04-10 05:14:27
13099,726553,0,45040112,7',Luis Alvarez (Charlotte Independence) Yellow Card at 7',2025-04-12 05:11:17
13099,726553,1,45040141,16',Michael Chilaka (Forward Madison FC) Yellow Card at 16',2025-04-12 05:11:17
13099,726553,2,45040176,26',Wallis Lapsley (Forward Madison FC) Yellow Card at 26',2025-04-12 05:11:17
13099,726553,3,45040177,26',Christian Chaney (Charlotte Independence) Yellow Card at 26',2025-04-12 05:11:17
13099,726553,4,45040221,38',Rafael Jauregui (Charlotte Independence) Yellow Card at 38',2025-04-12 05:11:17
13099,726553,5,45040241,43',Timmy Mehl (Forward Madison FC) Yellow Card at 43',2025-04-12 05:11:17
13099,726553,6,45040342,60',Nazeem Bartman (Forward Madison FC) Substitution at 60',2025-04-12 05:11:17
13099,726553,7,45040343,60',José Carrera-Garcia (Forward Madison FC) Substitution at 60',2025-04-12 05:11:17
13099,726553,8,45040344,63',Pele Ousmanou (Charlotte Independence) Yellow Card at 63',2025-04-12 05:11:17
13099,726553,9,45040372,68',Bachir Ndiaye (Charlotte Independence) Yellow Card at 68',2025-04-12 05:11:17
13099,726553,10,45040389,72',Christopher Garcia (Forward Madison FC) Substitution at 72',2025-04-12 05:11:17
13099,726553,11,45040390,72',John Murphy Jr. (Forward Madison FC) Substitution at 72',2025-04-12 05:11:17
13099,726553,12,45040398,74',Juan Moreno (Charlotte Independence) Substitution at 74',2025-04-12 05:11:17
13099,726553,13,45040399,74',Souaibou Marou (Charlotte Independence) Substitution at 74',2025-04-12 05:11:17
13099,726553,14,45040400,74',Ferrety Sousa (Forward Madison FC) Yellow Card at 74',2025-04-17 04:56:06
13099,726553,15,45040421,78',Omar Ciss (Charlotte Independence) Substitution at 78',2025-04-12 05:11:17
13099,726553,16,45040436,83',Luis Alvarez (Charlotte Independence) Goal at 83',2025-04-12 05:11:17
13099,726553,17,45040448,85',Omar Ciss (Charlotte Independence) Yellow Card at 85',2025-04-12 05:11:17
13099,726553,18,45040449,86',Damià Viader (Forward Madison FC) Substitution at 86',2025-04-12 05:11:17
13099,726553,19,45040451,88',Jon Bakero (Charlotte Independence) Yellow Card at 88',2025-04-12 05:11:17
13099,726553,20,45040452,88',Nazeem Bartman (Forward Madison FC) Goal at 88',2025-04-12 05:11:17
13099,726553,21,45040457,89',Fabrice Ngah (Charlotte Independence) Substitution at 89',2025-04-12 05:11:17
13099,726553,22,45040458,90'+1',José Carrera-Garcia (Forward Madison FC) Yellow Card at 91',2025-04-12 05:11:17
13099,726554,0,45054704,6',Mason Tunbridge (South Georgia Tormenta FC) Goal at 6',2025-04-13 05:23:21
13099,726554,1,45054908,16',Jackson Kasanze (South Georgia Tormenta FC) Yellow Card at 16',2025-04-13 05:23:21
13099,726554,2,45055153,28',Callum Stretch (South Georgia Tormenta FC) Substitution at 28',2025-04-13 05:23:21
13099,726554,3,45055154,29',Azaad Liadi (Portland Hearts of Pine) Penalty - Saved at 29',2025-04-13 05:23:21
13099,726554,4,45055182,30',Jaden Jones-Riley (Portland Hearts of Pine) Yellow Card at 30',2025-04-13 05:23:21
13099,726554,5,45055194,31',Handwalla Bwana (South Georgia Tormenta FC) Yellow Card at 31',2025-04-13 05:23:21
13099,726554,6,45055342,38',Anatolie Prepelita (South Georgia Tormenta FC) Yellow Card at 38',2025-04-13 05:23:21
13099,726554,7,45055988,45',Nathan Messer (Portland Hearts of Pine) Substitution at 45',2025-04-13 05:23:21
13099,726554,8,45055817,46',Yaniv Bazini (South Georgia Tormenta FC) Yellow Card at 46',2025-04-13 05:23:21
13099,726554,9,45056226,60',Titus Washington (Portland Hearts of Pine) Substitution at 60',2025-04-13 05:23:21
13099,726554,10,45056227,60',Ollie Wright (Portland Hearts of Pine) Substitution at 60',2025-04-13 05:23:21
13099,726554,11,45056228,60',Mikey Lopez (Portland Hearts of Pine) Substitution at 60',2025-04-13 05:23:21
13099,726554,12,45056474,69',Mikey Lopez (Portland Hearts of Pine) Yellow Card at 69',2025-04-13 05:23:21
13099,726554,13,45056475,70',Sebastián Vivas (South Georgia Tormenta FC) Substitution at 70',2025-04-13 05:23:21
13099,726554,14,45056476,70',Niall Reid-Stephen (South Georgia Tormenta FC) Substitution at 70',2025-04-13 05:23:21
13099,726554,15,45056596,74',Walter Varela (Portland Hearts of Pine) Substitution at 74',2025-04-13 05:23:21
13099,726554,16,45056712,79',Anatolie Prepelita (South Georgia Tormenta FC) Red Card at 79',2025-04-13 05:23:21
13099,726554,17,45056751,81',Patrick Langlois (Portland Hearts of Pine) Goal at 81',2025-04-13 05:23:21
13099,726554,18,45056788,83',Niall Reid-Stephen (South Georgia Tormenta FC) Goal at 83',2025-04-13 05:23:21
13099,726554,19,45056903,87',Sebastián Vivas (South Georgia Tormenta FC) Yellow Card at 87',2025-04-13 05:23:21
13099,726554,20,45056947,89',Walter Varela (Portland Hearts of Pine) Yellow Card at 89',2025-04-13 05:23:21
13099,726554,21,45057023,90'+2',Austin Pack (South Georgia Tormenta FC) Yellow Card at 92',2025-04-13 05:23:21
13099,726554,22,45057067,90'+4',Conor Doyle (South Georgia Tormenta FC) Substitution at 94',2025-04-13 05:23:21
13099,726555,0,45054283,8',Andrés Ferrín (FC Naples) Goal at 8',2025-04-13 05:23:21
13099,726555,1,45054414,18',Griffin Garnett (Richmond Kickers) Yellow Card at 18',2025-04-13 05:23:21
13099,726555,2,45054451,22',Karsen Henderlong (FC Naples) Goal at 22',2025-04-13 05:23:21
13099,726555,3,45054535,26',Maximiliano Schenfeld (Richmond Kickers) Yellow Card at 26',2025-04-13 05:23:21
13099,726555,4,45054672,36',Darwin Espinal (Richmond Kickers) Goal at 36',2025-04-20 15:49:37
13099,726555,5,45054762,38',Nils Seufert (Richmond Kickers) Substitution at 38',2025-04-13 05:23:21
13099,726555,6,45054841,42',Guilherme França (Richmond Kickers) Yellow Card at 42',2025-04-13 05:23:21
13099,726555,7,45054913,45'+1',Max Glasser (FC Naples) Yellow Card at 46',2025-04-13 05:23:21
13099,726555,8,45055400,45',Beckett Howell (Richmond Kickers) Substitution at 45',2025-04-13 05:23:21
13099,726555,9,45055401,45',Emiliano Terzaghi (Richmond Kickers) Substitution at 45',2025-04-13 05:23:21
13099,726555,10,45055402,45',Adrian Billhardt (Richmond Kickers) Substitution at 45',2025-04-13 05:23:21
13099,726555,11,45055403,50',Karsen Henderlong (FC Naples) Yellow Card at 50',2025-04-13 05:23:21
13099,726555,12,45055662,66',Luka Prpa (FC Naples) Substitution at 66',2025-04-20 15:49:37
13099,726555,13,45055698,68',Kevin O'Connor (FC Naples) Yellow Card at 68',2025-04-13 05:23:21
13099,726555,14,45055782,75',Edward Delgado (FC Naples) Yellow Card at 75',2025-04-13 05:23:21
13099,726555,15,45055891,79',Hayden Anderson (Richmond Kickers) Substitution at 79',2025-04-13 05:23:21
13099,726555,16,45055922,80',James Vaughan (Richmond Kickers) Yellow Card at 80',2025-04-13 05:23:21
13099,726555,17,45055962,82',Marc Torrellas (FC Naples) Substitution at 82',2025-04-20 15:49:37
13099,726555,18,45083989,87',Beckett Howell (Richmond Kickers) Yellow Card at 87',2025-04-20 15:49:37
13099,726555,19,45056136,89',Tyler Pasnik (FC Naples) Substitution at 89',2025-04-20 15:49:37
13099,726555,20,45056137,89',Gustavo Fernandes (FC Naples) Substitution at 89',2025-04-20 15:49:37
13099,726555,21,45056138,89',Roscoe Rubinstein (FC Naples) Substitution at 89',2025-04-20 15:49:37
13099,726555,22,45056323,90'+7',Luka Prpa (FC Naples) Yellow Card at 97',2025-04-20 15:49:37
13099,726556,0,45057912,3',Carlos Avilez (AV Alta FC) Yellow Card at 3',2025-04-13 05:23:21
13099,726556,1,45057913,4',Matthew Bentley (Chattanooga Red Wolves) Penalty - Scored at 4',2025-04-13 05:23:21
13099,726556,2,45057998,12',Jimmie Villalobos (AV Alta FC) Goal at 12',2025-04-13 05:23:21
13099,726556,3,45058050,15',Alassane Maboumou (AV Alta FC) Yellow Card at 15',2025-04-13 05:23:21
13099,726556,4,45058304,37',Jimmie Villalobos (AV Alta FC) Goal at 37',2025-04-13 05:23:21
13099,726556,5,45058347,39',Emmanuel Alaribe (AV Alta FC) Yellow Card at 39',2025-04-13 05:23:21
13099,726556,6,45058373,42',Michael Knapp (Chattanooga Red Wolves) Yellow Card at 42',2025-04-13 05:23:21
13099,726556,7,45058449,45'+6',Jordan Ayimbila (Chattanooga Red Wolves) Yellow Card at 51',2025-04-13 05:23:21
13099,726556,8,45058693,60',Pedro Hernandez (Chattanooga Red Wolves) Substitution at 60',2025-04-13 05:23:21
13099,726556,9,45058694,61',Alhassan (Chattanooga Red Wolves) Substitution at 61',2025-04-13 05:23:21
13099,726556,10,45058756,69',Eduardo Blancas (AV Alta FC) Substitution at 69',2025-04-13 05:23:21
13099,726556,11,45058766,71',Omar Gómez (Chattanooga Red Wolves) Substitution at 71',2025-04-13 05:23:21
13099,726556,12,45058780,75',Joaquin Acuna (AV Alta FC) Substitution at 75',2025-04-13 05:23:21
13099,726556,13,45058785,78',Matthew Bentley (Chattanooga Red Wolves) Goal at 78',2025-04-13 05:23:21
13099,726556,14,45058816,86',Joaquin Acuna (AV Alta FC) Penalty - Scored at 86',2025-04-13 05:23:21
13099,726556,15,45058830,87',Erick Ceja (AV Alta FC) Substitution at 87',2025-04-13 05:23:21
13099,726556,16,45058832,87',Owen Green (Chattanooga Red Wolves) Substitution at 87',2025-04-13 05:23:21
13099,726556,17,45058831,88',Ashkanov Apollon (AV Alta FC) Substitution at 88',2025-04-13 05:23:21
13099,726556,18,45058887,90'+8',Owen Green (Chattanooga Red Wolves) Yellow Card at 98',2025-04-20 15:49:37
13099,726557,0,45068167,13',Derek Waldeck (Spokane Velocity FC) Goal at 13',2025-04-14 05:18:05
13099,726557,1,45068657,44',Philip Spengler (Texoma FC) Yellow Card at 44',2025-04-14 05:18:05
13099,726557,2,45068891,45',Brayan Padilla (Texoma FC) Substitution at 45',2025-04-14 05:18:05
13099,726557,3,45068959,55',Shavon John-Brown (Spokane Velocity FC) Goal at 55',2025-04-14 05:18:05
13099,726557,4,45069035,60',Philip Spengler (Texoma FC) Goal at 60',2025-04-14 05:18:05
13099,726557,5,45069049,62',Anuar Peláez (Spokane Velocity FC) Goal at 62',2025-04-14 05:18:05
13099,726557,6,45069092,64',Brayan Padilla (Texoma FC) Yellow Card at 64',2025-04-14 05:18:05
13099,726557,7,45069119,67',William Perkins (Texoma FC) Yellow Card at 67',2025-04-14 05:18:05
13099,726557,8,45069180,72',Jack Denton (Spokane Velocity FC) Substitution at 72',2025-04-14 05:18:05
13099,726557,9,45069181,72',Nil Vinyals (Spokane Velocity FC) Substitution at 72',2025-04-14 05:18:05
13099,726557,10,45069182,72',Ismaila Jome (Spokane Velocity FC) Substitution at 72',2025-04-14 05:18:05
13099,726557,11,45069213,75',Ismaila Jome (Spokane Velocity FC) Goal at 75',2025-04-14 05:18:05
13099,726557,12,45069356,84',Masango Akale (Spokane Velocity FC) Substitution at 84',2025-04-14 05:18:05
13099,726557,13,45069394,86',Jack Denton (Spokane Velocity FC) Yellow Card at 86',2025-04-14 05:18:05
13099,726557,14,45069395,86',Leland Gray (Texoma FC) Substitution at 86',2025-04-14 05:18:05
13099,726558,0,45106928,18',Osvaldo Lay (AV Alta FC) Yellow Card at 18',2025-04-20 15:49:37
13099,726558,1,45107116,37',Jack Denton (Spokane Velocity FC) Goal at 37',2025-04-20 15:49:37
13099,726558,2,45107198,43',Luis Gil (Spokane Velocity FC) Goal at 43',2025-04-20 15:49:37
13099,726558,3,45107205,45',Shavon John-Brown (Spokane Velocity FC) Yellow Card at 45',2025-04-20 15:49:37
13099,726558,4,45107282,45'+8',Carlos Avilez (AV Alta FC) Substitution at 53',2025-04-20 15:49:37
13099,726558,5,45107414,45',Kaloyan Pehlivanov (AV Alta FC) Substitution at 45',2025-04-20 15:49:37
13099,726558,6,45107521,58',Jerry Desdunes (AV Alta FC) Substitution at 58',2025-04-20 15:49:37
13099,726558,7,45107522,58',Emmanuel Alaribe (AV Alta FC) Substitution at 58',2025-04-20 15:49:37
13099,726558,8,45107542,60',Carlos Merancio (Spokane Velocity FC) Yellow Card at 60',2025-04-20 15:49:37
13099,726558,9,45107549,62',Eduardo Blancas (AV Alta FC) Goal at 62',2025-04-20 15:49:37
13099,726558,10,45107558,63',Javier Martin Gil (Spokane Velocity FC) Substitution at 63',2025-04-20 15:49:37
13099,726558,11,45107559,64',Lucky Opara (Spokane Velocity FC) Yellow Card at 64',2025-04-20 15:49:37
13099,726558,12,45107640,78',Adam Aoumaich (AV Alta FC) Substitution at 78',2025-04-20 15:49:37
13099,726558,13,45107697,86',Meredith Bryce (Spokane Velocity FC) Substitution at 86',2025-04-20 15:49:37
13099,726558,14,45107698,86',Luis Gil (Spokane Velocity FC) Yellow Card at 86',2025-04-20 15:49:37
13099,726558,15,45107744,90'+1',Masango Akale (Spokane Velocity FC) Substitution at 91',2025-04-20 15:49:37
13099,726558,16,45107745,90'+2',Marcelo Lage (Spokane Velocity FC) Substitution at 92',2025-04-20 15:49:37
13099,726559,0,45102496,2',Darwin Espinal (Richmond Kickers) Goal at 2',2025-04-20 15:49:37
13099,726559,1,45102540,8',Noah Powder (Westchester SC) Goal at 8',2025-04-20 15:49:37
13099,726559,2,45102549,9',Stephen Payne (Westchester SC) Yellow Card at 9',2025-04-20 15:49:37
13099,726559,3,45102773,32',Darwin Espinal (Richmond Kickers) Goal at 32',2025-04-20 15:49:37
13099,726559,4,45102867,43',Joel Johnson Alajarin (Westchester SC) Yellow Card at 43',2025-04-20 15:49:37
13099,726559,5,45103086,45',Koen Blommestijn (Westchester SC) Substitution at 45',2025-04-20 15:49:37
13099,726559,6,45103121,53',Samory Powder (Westchester SC) Goal at 53',2025-04-20 15:49:37
