seasonType,eventId,commentaryOrder,playId,clockDisplayValue,commentaryText,updateDateTime
13099,726559,7,45103170,59',Joshua Kirkland (Richmond Kickers) Substitution at 59',2025-04-20 15:49:37
13099,726559,8,45103171,59',Emiliano Terzaghi (Richmond Kickers) Substitution at 59',2025-04-20 15:49:37
13099,726559,9,45103200,63',Joshua Kirkland (Richmond Kickers) Goal at 63',2025-04-20 15:49:37
13099,726559,10,45103279,70',Koen Blommestijn (Westchester SC) Yellow Card at 70',2025-04-20 15:49:37
13099,726559,11,45103425,71',Conor McGlynn (Westchester SC) Substitution at 71',2025-04-20 15:49:37
13099,726559,12,45103401,72',Noah Powder (Westchester SC) Yellow Card at 72',2025-04-20 15:49:37
13099,726559,13,45103370,73',Andrew Jean-Baptiste (Westchester SC) Substitution at 73',2025-04-20 15:49:37
13099,726559,14,45103371,77',Daniel Bouman (Westchester SC) Yellow Card at 77',2025-04-20 15:49:37
13099,726559,15,45103497,83',Conor McGlynn (Westchester SC) Goal at 83',2025-04-20 15:49:37
13099,726559,16,45103566,86',Ermin Mackic (Westchester SC) Substitution at 86',2025-04-20 15:49:37
13099,726559,17,45103645,90',Maximiliano Schenfeld (Richmond Kickers) Yellow Card at 90',2025-04-20 15:49:37
13099,726559,18,45103646,90'+2',Adrian Billhardt (Richmond Kickers) Substitution at 92',2025-04-20 15:49:37
13099,726559,19,45103714,90'+4',Guilherme França (Richmond Kickers) Yellow Card at 94',2025-04-20 15:49:37
13099,726559,20,45103741,90'+5',Dakota Barnathan (Richmond Kickers) Yellow Card at 95',2025-04-20 15:49:37
13099,726559,21,45103724,90'+7',Juan Carlos Obregón Jr (Westchester SC) Penalty - Scored at 97',2025-04-20 15:49:37
13099,726559,22,45103759,90'+9',Joshua Kirkland (Richmond Kickers) Goal at 99',2025-04-20 15:49:37
13099,726560,0,45103104,9',Stuart Ritchie (One Knoxville) Yellow Card at 9',2025-04-20 15:49:37
13099,726560,1,45103223,25',Stavros Zarokostas (One Knoxville) Yellow Card at 25',2025-04-20 15:49:37
13099,726560,2,45103426,38',Abel Caputo (One Knoxville) Yellow Card at 38',2025-04-20 15:49:37
13099,726560,3,45103518,43',Ian Garrett (FC Naples) Yellow Card at 43',2025-04-20 15:49:37
13099,726560,4,45103540,45',Kempes Waldemar Tekiela (One Knoxville) Penalty - Scored at 45',2025-04-20 15:49:37
13099,726560,5,45103576,45',Brecc Evans (FC Naples) Yellow Card at 45',2025-04-20 15:49:37
13099,726560,6,45103951,45',Nicola Rosamilia (One Knoxville) Substitution at 45',2025-04-20 15:49:37
13099,726560,7,45103952,45',Julian Cisneros (FC Naples) Substitution at 45',2025-04-20 15:49:37
13099,726560,8,45103953,45',Andrés Ferrín (FC Naples) Substitution at 45',2025-04-20 15:49:37
13099,726560,9,45103954,45',Karsen Henderlong (FC Naples) Substitution at 45',2025-04-20 15:49:37
13099,726560,10,45104187,57',Gustavo Fernandes (FC Naples) Yellow Card at 57',2025-04-20 15:49:37
13099,726560,11,45104278,63',Jayden Onen (FC Naples) Yellow Card at 63',2025-04-20 15:49:37
13099,726560,12,45104333,66',Max Glasser (FC Naples) Substitution at 66',2025-04-20 15:49:37
13099,726560,13,45104351,66',Christopher Heckenberg (FC Naples) Substitution at 66',2025-04-20 15:49:37
13099,726560,14,45104408,72',Angelo Kelly-Rosales (One Knoxville) Substitution at 72',2025-04-20 15:49:37
13099,726560,15,45104530,77',Sean Lewis (One Knoxville) Yellow Card at 77',2025-04-20 15:49:37
13099,726560,16,45104715,81',Babacar Diene (One Knoxville) Substitution at 81',2025-04-20 15:49:37
13099,726560,17,45105039,90'+3',Jake Dengler (FC Naples) Yellow Card at 93',2025-04-20 15:49:37
13099,726560,18,45105040,90'+3',Sivert Haugli (One Knoxville) Yellow Card at 93',2025-04-20 15:49:37
13099,726561,0,45103027,2',Carlos Anguiano (Greenville Triumph) Yellow Card at 2',2025-04-20 15:49:37
13099,726561,1,45103918,45',Devin Benton (Greenville Triumph) Substitution at 45',2025-04-20 15:49:37
13099,726561,2,45103976,53',Zahir Vasquez (Chattanooga Red Wolves) Goal at 53',2025-04-20 15:49:37
13099,726561,3,45104039,56',Ivan Agyaakwah (Greenville Triumph) Substitution at 56',2025-04-20 15:49:37
13099,726561,4,45104292,68',Pedro Hernandez (Chattanooga Red Wolves) Substitution at 68',2025-04-20 15:49:37
13099,726561,5,45104293,68',Alhassan (Chattanooga Red Wolves) Substitution at 68',2025-04-20 15:49:37
13099,726561,6,45104342,72',Chevone Marsh (Greenville Triumph) Substitution at 72',2025-04-20 15:49:37
13099,726561,7,45104343,72',Leonardo Castro (Greenville Triumph) Substitution at 72',2025-04-20 15:49:37
13099,726561,8,45104344,73',Omar Gómez (Chattanooga Red Wolves) Substitution at 73',2025-04-20 15:49:37
13099,726561,9,45104550,82',Michael Gonzalez (Greenville Triumph) Substitution at 82',2025-04-20 15:49:37
13099,726561,10,45104835,90'+1',Kimball Jackson (Chattanooga Red Wolves) Substitution at 91',2025-04-25 04:54:27
13099,726561,11,45105012,90'+6',Chevone Marsh (Greenville Triumph) Yellow Card at 96',2025-04-20 15:49:37
13099,726562,0,45103228,28',Jon Paul Jordan Ii (Texoma FC) Yellow Card at 28',2025-04-20 15:49:37
13099,726562,1,45104202,61',Mitchell Osmond (Forward Madison FC) Yellow Card at 61',2025-04-20 15:49:37
13099,726562,2,45104243,63',Timmy Mehl (Forward Madison FC) Yellow Card at 63',2025-04-20 15:49:37
13099,726562,3,45104257,64',Brayan Padilla (Texoma FC) Substitution at 64',2025-04-20 15:49:37
13099,726562,4,45104273,64',Ozzie Ramos (Texoma FC) Substitution at 64',2025-04-20 15:49:37
13099,726562,5,45104307,65',David Mason (Texoma FC) Yellow Card at 65',2025-04-20 15:49:37
13099,726562,6,45104308,66',Damià Viader (Forward Madison FC) Substitution at 66',2025-04-20 15:49:37
13099,726562,7,45104369,72',Maciej Bortniczuk (Texoma FC) Substitution at 72',2025-04-20 15:49:37
13099,726562,8,45104382,73',Brayan Padilla (Texoma FC) Goal at 73',2025-04-20 15:49:37
13099,726562,9,45104539,79',Christopher Garcia (Forward Madison FC) Substitution at 79',2025-04-20 15:49:37
13099,726562,10,45104540,79',Angelo Calfo (Texoma FC) Substitution at 79',2025-04-20 15:49:37
13099,726562,11,45104541,79',Michael Chilaka (Forward Madison FC) Substitution at 79',2025-04-26 04:57:15
13099,726562,12,45104567,79',Lamin Jawneh (Texoma FC) Yellow Card at 79',2025-04-26 04:57:15
13099,726562,13,45104701,84',Brayan Padilla (Texoma FC) Yellow Card at 84',2025-04-20 15:49:37
13099,726562,14,45104821,88',John Murphy Jr. (Forward Madison FC) Substitution at 88',2025-04-20 15:49:37
13099,726562,15,45104822,88',Adrien Graffin (Forward Madison FC) Substitution at 88',2025-04-20 15:49:37
13099,726562,16,45105186,90'+1',Brandon Mcmanus (Texoma FC) Yellow Card at 91',2025-04-20 15:49:37
13099,726562,17,45105214,90'+1',Brandon Mcmanus (Texoma FC) Red Card at 91',2025-04-20 15:49:37
13099,726562,18,45105029,90'+5',Derek Gebhard (Forward Madison FC) Goal at 95',2025-04-20 15:49:37
13099,726563,0,45113543,9',Christian Chaney (Charlotte Independence) Goal at 9',2025-04-21 02:19:56
13099,726563,1,45114154,45'+3',Aaron Walker (South Georgia Tormenta FC) Yellow Card at 48',2025-04-21 02:19:56
13099,726563,2,45114337,45',Omar Ciss (Charlotte Independence) Substitution at 45',2025-04-21 02:19:56
13099,726563,3,45114368,48',Mason Tunbridge (South Georgia Tormenta FC) Penalty - Scored at 48',2025-04-21 02:19:56
13099,726563,4,45114387,49',Javen Romero (Charlotte Independence) Yellow Card at 49',2025-04-21 02:19:56
13099,726563,5,45114498,61',Bachir Ndiaye (Charlotte Independence) Goal at 61',2025-04-21 02:19:56
13099,726563,6,45114537,65',Jonathan Nyandjo (South Georgia Tormenta FC) Substitution at 65',2025-04-21 02:19:56
13099,726563,7,45114538,65',Sebastián Vivas (South Georgia Tormenta FC) Substitution at 65',2025-04-21 02:19:56
13099,726563,8,45114623,72',Fabrice Ngah (Charlotte Independence) Substitution at 72',2025-04-21 02:19:56
13099,726563,9,45114628,73',Jon Bakero (Charlotte Independence) Goal at 73',2025-04-21 02:19:56
13099,726563,10,45114656,75',Joseph Pérez (South Georgia Tormenta FC) Substitution at 75',2025-04-21 02:19:56
13099,726563,11,45114657,75',Conor Doyle (South Georgia Tormenta FC) Substitution at 75',2025-04-21 02:19:56
13099,726563,12,45114658,75',Handwalla Bwana (South Georgia Tormenta FC) Substitution at 75',2025-04-21 02:19:56
13099,726563,13,45114709,81',Souaibou Marou (Charlotte Independence) Substitution at 81',2025-04-21 02:19:56
13099,726563,14,45114754,87',Juan Moreno (Charlotte Independence) Substitution at 87',2025-04-21 02:19:56
13099,726563,15,45114755,87',Pele Ousmanou (Charlotte Independence) Substitution at 87',2025-04-21 02:19:56
13099,726563,16,45114760,88',Sebastián Vivas (South Georgia Tormenta FC) Goal at 88',2025-04-21 02:19:56
13099,726564,0,45179566,3',Joshua Kirkland (Richmond Kickers) Goal at 3',2025-05-03 04:54:37
13099,726564,1,45179569,31',Connor Evans (Greenville Triumph) Goal at 31',2025-05-03 04:54:37
13099,726564,2,45179570,33',Ben Zakowski (Greenville Triumph) Goal at 33',2025-05-03 04:54:37
13099,726564,3,45179571,35',Leonardo Castro (Greenville Triumph) Yellow Card at 35',2025-05-03 04:54:37
13099,726564,4,45179572,39',Joshua Kirkland (Richmond Kickers) Goal at 39',2025-05-03 04:54:37
13099,726564,5,45179602,52',Maximiliano Schenfeld (Richmond Kickers) Yellow Card at 52',2025-05-03 04:54:37
13099,726564,6,45179680,69',Michael Gonzalez (Greenville Triumph) Substitution at 69',2025-05-03 04:54:37
13099,726564,7,45179689,70',Sebastián Velásquez (Greenville Triumph) Substitution at 70',2025-05-09 04:56:32
13099,726564,8,45179701,71',Hayden Anderson (Richmond Kickers) Substitution at 71',2025-05-03 04:54:37
13099,726564,9,45179711,72',Carlos Anguiano (Greenville Triumph) Yellow Card at 72',2025-05-03 04:54:37
13099,726564,10,45179735,76',Mathew Bolduc (Richmond Kickers) Substitution at 76',2025-05-03 04:54:37
13099,726564,11,45179744,76',James Vaughan (Richmond Kickers) Substitution at 76',2025-05-03 04:54:37
13099,726564,12,45179768,80',Chandler O'Dwyer (Richmond Kickers) Goal at 80',2025-05-03 04:54:37
13099,726564,13,45179792,84',Ivan Agyaakwah (Greenville Triumph) Goal at 84',2025-05-03 04:54:37
13099,726564,14,45179815,85',Ropapa Mensah (Greenville Triumph) Substitution at 85',2025-05-03 04:54:37
13099,726564,15,45179824,86',Brandon Fricke (Greenville Triumph) Yellow Card at 86',2025-05-03 04:54:37
13099,726564,16,45179845,90'+1',Nzuhri Biggar (Greenville Triumph) Substitution at 91',2025-05-03 04:54:37
13099,726564,17,45179864,90'+3',Landon Johnson (Richmond Kickers) Substitution at 93',2025-05-03 04:54:37
13099,726565,0,45193704,22',Philip Spengler (Texoma FC) Goal at 22',2025-05-05 05:02:58
13099,726565,1,45193807,28',Clay Dimick (Charlotte Independence) Yellow Card at 28',2025-05-05 05:02:58
13099,726565,2,45193820,29',Solomon Asanté (Texoma FC) Goal at 29',2025-05-05 05:02:58
13099,726565,3,45194042,43',Christian Chaney (Charlotte Independence) Goal at 43',2025-05-05 05:02:58
13099,726565,4,45194085,45',Solomon Asanté (Texoma FC) Yellow Card at 45',2025-05-05 05:02:58
13099,726565,5,45194145,45'+2',Omar Ciss (Charlotte Independence) Yellow Card at 47',2025-05-05 05:02:58
13099,726565,6,45194688,53',Clay Dimick (Charlotte Independence) Goal at 53',2025-05-05 05:02:58
13099,726565,7,45194712,55',Alfredo Midence (Charlotte Independence) Goal at 55',2025-05-05 05:02:58
13099,726565,8,45194814,60',Lamin Jawneh (Texoma FC) Substitution at 60',2025-05-05 05:02:58
13099,726565,9,45194845,62',Luis Alvarez (Charlotte Independence) Yellow Card at 62',2025-05-05 05:02:58
13099,726565,10,45195159,76',Bachir Ndiaye (Charlotte Independence) Yellow Card at 76',2025-05-05 05:02:58
13099,726565,11,45195160,77',David Mason (Texoma FC) Substitution at 77',2025-05-05 05:02:58
13099,726565,12,45195184,77',Teddy Baker (Texoma FC) Substitution at 77',2025-05-05 05:02:58
13099,726565,13,45195185,77',Dane Domic (Texoma FC) Substitution at 77',2025-05-05 05:02:58
13099,726565,14,45195186,78',Souaibou Marou (Charlotte Independence) Substitution at 78',2025-05-05 05:02:58
13099,726565,15,45195187,79',Fabrice Ngah (Charlotte Independence) Substitution at 79',2025-05-05 05:02:58
13099,726565,16,45195266,84',Philip Spengler (Texoma FC) Goal at 84',2025-05-05 05:02:58
13099,726565,17,45195327,87',Dane Domic (Texoma FC) Yellow Card at 87',2025-05-05 05:02:58
13099,726565,18,45195343,89',Juan Moreno (Charlotte Independence) Substitution at 89',2025-05-10 04:57:41
13099,726565,19,45195434,90'+5',Luis Alvarez (Charlotte Independence) Penalty - Scored at 95',2025-05-05 05:02:58
13099,726565,20,45195469,90'+7',Pele Ousmanou (Charlotte Independence) Substitution at 97',2025-05-05 05:02:58
13099,726566,0,45192233,13',Laurence Wootton (Union Omaha) Substitution at 13',2025-05-05 05:02:58
13099,726566,1,45192413,37',Derek Gebhard (Forward Madison FC) Yellow Card at 37',2025-05-05 05:02:58
13099,726566,2,45192784,45',Kemy Amiche (Union Omaha) Substitution at 45',2025-05-05 05:02:58
13099,726566,3,45192850,54',John Murphy Jr. (Forward Madison FC) Yellow Card at 54',2025-05-05 05:02:58
13099,726566,4,45192878,57',Brandon Knapp (Union Omaha) Yellow Card at 57',2025-05-05 05:02:58
13099,726566,5,45192906,58',José Carrera-Garcia (Forward Madison FC) Yellow Card at 58',2025-05-05 05:02:58
13099,726566,6,45192955,66',Aiden Mesias (Forward Madison FC) Substitution at 66',2025-05-05 05:02:58
13099,726566,7,45192963,66',Sergio Ors (Union Omaha) Substitution at 66',2025-05-05 05:02:58
13099,726566,8,45193108,80',Nico Brown (Forward Madison FC) Yellow Card at 80',2025-05-05 05:02:58
13099,726566,9,45193140,82',Damià Viader (Forward Madison FC) Substitution at 82',2025-05-05 05:02:58
13099,726566,10,45193185,86',Michael Chilaka (Forward Madison FC) Substitution at 86',2025-05-05 05:02:58
13099,726568,0,45204982,2',Stuart Ritchie (One Knoxville) Goal at 2',2025-05-05 05:02:58
13099,726568,1,45205168,29',Sivert Haugli (One Knoxville) Substitution at 29',2025-05-05 05:02:58
13099,726568,2,45205224,33',Michel Poon-Angeron (Portland Hearts of Pine) Yellow Card at 33',2025-05-05 05:02:58
13099,726568,3,45205358,45'+2',Masashi Wada (Portland Hearts of Pine) Goal at 47',2025-05-05 05:02:58
13099,726568,4,45205606,45'+5',Abel Caputo (One Knoxville) Yellow Card at 50',2025-05-05 05:02:58
13099,726568,5,45205667,58',Jake Keegan (Portland Hearts of Pine) Substitution at 58',2025-05-05 05:02:58
13099,726568,6,45205708,63',Nicola Rosamilia (One Knoxville) Substitution at 63',2025-05-05 05:02:58
13099,726568,7,45205717,63',Angelo Kelly-Rosales (One Knoxville) Substitution at 63',2025-05-05 05:02:58
13099,726568,8,45205718,63',Babacar Diene (One Knoxville) Substitution at 63',2025-05-05 05:02:58
13099,726568,9,45205770,69',Colby Quinones (Portland Hearts of Pine) Substitution at 69',2025-05-05 05:02:58
13099,726568,10,45205803,73',Sivert Haugli (One Knoxville) Yellow Card at 73',2025-05-05 05:02:58
13099,726568,11,45205885,82',Titus Washington (Portland Hearts of Pine) Substitution at 82',2025-05-05 05:02:58
13099,726568,12,45205923,86',Babacar Diene (One Knoxville) Yellow Card at 86',2025-05-05 05:02:58
13099,726569,0,45205539,5',Samory Powder (Westchester SC) Goal at 5',2025-05-05 05:02:58
13099,726569,1,45205711,23',Conor McGlynn (Westchester SC) Yellow Card at 23',2025-05-05 05:02:58
13099,726569,2,45205877,42',Noah Powder (Westchester SC) Yellow Card at 42',2025-05-05 05:02:58
13099,726569,3,45205901,44',Pierre Reedy (Spokane Velocity FC) Goal at 44',2025-05-05 05:02:58
13099,726569,4,45205912,45'+1',Anuar Peláez (Spokane Velocity FC) Yellow Card at 46',2025-05-05 05:02:58
13099,726569,5,45206012,49',Anuar Peláez (Spokane Velocity FC) Goal at 49',2025-05-05 05:02:58
13099,726569,6,45206018,49',Dane Jacomen (Westchester SC) Yellow Card at 49',2025-05-05 05:02:58
13099,726569,7,45206047,53',Juan Carlos Obregón Jr (Westchester SC) Penalty - Saved at 53',2025-05-05 05:02:58
13099,726569,8,45206093,57',Bobby Pierre (Westchester SC) Yellow Card at 57',2025-05-05 05:02:58
13099,726569,9,45206094,58',Collin Fernandez (Spokane Velocity FC) Substitution at 58',2025-05-05 05:02:58
13099,726569,10,45206151,63',Ismaila Jome (Spokane Velocity FC) Goal at 63',2025-05-05 05:02:58
13099,726569,11,45206176,66',Dean Guezen (Westchester SC) Substitution at 66',2025-05-05 05:02:58
13099,726569,12,45206177,66',Daniel Bouman (Westchester SC) Substitution at 66',2025-05-05 05:02:58
13099,726569,13,45206211,69',Nil Vinyals (Spokane Velocity FC) Substitution at 69',2025-05-05 05:02:58
13099,726569,14,45206212,69',Masango Akale (Spokane Velocity FC) Substitution at 69',2025-05-05 05:02:58
13099,726569,15,45206213,70',Neco Brett (Spokane Velocity FC) Substitution at 70',2025-05-05 05:02:58
13099,726569,16,45206276,77',Koen Blommestijn (Westchester SC) Substitution at 77',2025-05-05 05:02:58
13099,726569,17,45206365,85',Samory Powder (Westchester SC) Yellow Card at 85',2025-05-10 04:57:41
13099,726569,18,45206435,90'+3',Mink Peeters (Westchester SC) Substitution at 93',2025-05-05 05:02:58
13099,726569,19,45206447,90'+3',Andrew Jean-Baptiste (Westchester SC) Substitution at 93',2025-05-05 05:02:58
13099,726569,20,45206448,90'+3',Javier Martin Gil (Spokane Velocity FC) Substitution at 93',2025-05-05 05:02:58
13099,726570,0,45225412,58',Angelo Kelly-Rosales (One Knoxville) Substitution at 58',2025-05-10 04:57:41
13099,726570,1,45225418,58',Mikkel Gøling (One Knoxville) Substitution at 58',2025-05-10 04:57:41
13099,726570,2,45225419,58',Babacar Diene (One Knoxville) Substitution at 58',2025-05-10 04:57:41
13099,726570,3,45225427,59',Nicola Rosamilia (One Knoxville) Goal at 59',2025-05-10 04:57:41
13099,726570,4,45225428,61',Jake Crull (Forward Madison FC) Goal at 61',2025-05-10 04:57:41
13099,726570,5,45225434,64',Derek Gebhard (Forward Madison FC) Substitution at 64',2025-05-10 04:57:41
13099,726570,6,45225443,66',Nico Brown (Forward Madison FC) Yellow Card at 66',2025-05-10 04:57:41
13099,726570,7,45225452,71',Giovanni Calixtro (One Knoxville) Substitution at 71',2025-05-10 04:57:41
13099,726570,8,45225475,81',Jaheim Brown (One Knoxville) Yellow Card at 81',2025-05-10 04:57:41
13099,726570,9,45225476,82',Adrien Graffin (Forward Madison FC) Substitution at 82',2025-05-10 04:57:41
13099,726570,10,45225510,90'+1',Babacar Diene (One Knoxville) Yellow Card at 91',2025-05-10 04:57:41
13099,726571,0,45238372,35',Marco Milanese (Union Omaha) Yellow Card at 35',2025-05-12 04:52:04
13099,726571,1,45238653,45'+2',Azaad Liadi (Portland Hearts of Pine) Goal at 47',2025-05-12 04:52:04
13099,726571,2,45239096,45',Colby Quinones (Portland Hearts of Pine) Substitution at 45',2025-05-12 04:52:04
13099,726571,3,45239097,48',Nathan Messer (Portland Hearts of Pine) Yellow Card at 48',2025-05-12 04:52:04
13099,726571,4,45239342,54',Samuel Kwaku Owusu (Union Omaha) Goal at 54',2025-05-12 04:52:04
13099,726571,5,45239574,66',Titus Washington (Portland Hearts of Pine) Substitution at 66',2025-05-12 04:52:04
13099,726571,6,45239610,66',Kemy Amiche (Union Omaha) Substitution at 66',2025-05-12 04:52:04
13099,726571,7,45239653,69',Charlie Ostrem (Union Omaha) Yellow Card at 69',2025-05-12 04:52:04
13099,726571,8,45239693,71',Michael Reilly (Portland Hearts of Pine) Substitution at 71',2025-05-12 04:52:04
13099,726571,9,45239694,71',Ollie Wright (Portland Hearts of Pine) Substitution at 71',2025-05-12 04:52:04
13099,726571,10,45239720,71',Shandon Wright (Portland Hearts of Pine) Yellow Card at 71',2025-05-12 04:52:04
13099,726571,11,45239721,73',Brent Kallman (Union Omaha) Yellow Card at 73',2025-05-12 04:52:04
13099,726571,12,45239739,74',Titus Washington (Portland Hearts of Pine) Yellow Card at 74',2025-05-12 04:52:04
13099,726571,13,45239907,83',Joe Gallardo (Union Omaha) Penalty - Scored at 83',2025-05-12 04:52:04
13099,726571,14,45239925,84',Nathaniel James (Portland Hearts of Pine) Substitution at 84',2025-05-12 04:52:04
13099,726571,15,45239924,85',Brandon Knapp (Union Omaha) Substitution at 85',2025-05-12 04:52:04
13099,726571,16,45239952,86',Nathaniel James (Portland Hearts of Pine) Goal at 86',2025-05-12 04:52:04
13099,726571,17,45239973,87',Colby Quinones (Portland Hearts of Pine) Yellow Card at 87',2025-05-12 04:52:04
13099,726571,18,45240037,90'+3',Michael Reilly (Portland Hearts of Pine) Yellow Card at 93',2025-05-12 04:52:04
13099,726572,0,45237754,22',Anuar Peláez (Spokane Velocity FC) Penalty - Scored at 22',2025-05-12 04:52:04
13099,726572,1,45238601,56',Derek Waldeck (Spokane Velocity FC) Yellow Card at 56',2025-05-12 04:52:04
13099,726572,2,45238602,57',Neco Brett (Spokane Velocity FC) Substitution at 57',2025-05-12 04:52:04
13099,726572,3,45238603,58',Collin Fernandez (Spokane Velocity FC) Substitution at 58',2025-05-12 04:52:04
13099,726572,4,45238624,58',Nil Vinyals (Spokane Velocity FC) Substitution at 58',2025-05-12 04:52:04
13099,726572,5,45238820,65',Mason Tunbridge (South Georgia Tormenta FC) Substitution at 65',2025-05-12 04:52:04
13099,726572,6,45239092,78',Aaron Walker (South Georgia Tormenta FC) Substitution at 78',2025-05-12 04:52:04
13099,726572,7,45239093,78',Conor Doyle (South Georgia Tormenta FC) Substitution at 78',2025-05-12 04:52:04
13099,726572,8,45239094,78',Handwalla Bwana (South Georgia Tormenta FC) Substitution at 78',2025-05-12 04:52:04
13099,726572,9,45239343,86',Mark Hernández (Spokane Velocity FC) Substitution at 86',2025-05-12 04:52:04
13099,726572,10,45239344,86',Masango Akale (Spokane Velocity FC) Substitution at 86',2025-05-12 04:52:04
13099,726572,11,45239533,90'+3',Liam Healy (South Georgia Tormenta FC) Substitution at 93',2025-05-12 04:52:04
13099,726572,12,45239534,90'+3',Thabo Nare (South Georgia Tormenta FC) Substitution at 93',2025-05-12 04:52:04
13099,726572,13,45239563,90'+5',Marcelo Lage (Spokane Velocity FC) Substitution at 95',2025-05-12 04:52:04
13099,726572,14,45239606,90'+6',Javier Martin Gil (Spokane Velocity FC) Yellow Card at 96',2025-05-12 04:52:04
13099,726573,0,45233943,8',Conor McGlynn (Westchester SC) Goal at 8',2025-05-12 04:52:04
13099,726573,1,45234117,13',Anton Sorenson (Charlotte Independence) Yellow Card at 13',2025-05-12 04:52:04
13099,726573,2,45234807,35',Jonathan Bolanos (Westchester SC) Yellow Card at 35',2025-05-12 04:52:04
13099,726573,3,45234808,37',Javen Romero (Charlotte Independence) Yellow Card at 37',2025-05-12 04:52:04
13099,726573,4,45235078,40',Juan Carlos Obregón Jr (Westchester SC) Penalty - Scored at 40',2025-05-12 04:52:04
13099,726573,5,45235612,45',Souaibou Marou (Charlotte Independence) Substitution at 45',2025-05-12 04:52:04
13099,726573,6,45235621,45',Fabrice Ngah (Charlotte Independence) Substitution at 45',2025-05-12 04:52:04
13099,726573,7,45235659,50',Joel Johnson Alajarin (Westchester SC) Yellow Card at 50',2025-05-12 04:52:04
13099,726573,8,45235716,53',Nick Spielman (Charlotte Independence) Yellow Card at 53',2025-05-12 04:52:04
13099,726573,9,45235744,57',Souaibou Marou (Charlotte Independence) Goal at 57',2025-05-12 04:52:04
13099,726573,10,45235802,63',Noah Powder (Westchester SC) Substitution at 63',2025-05-12 04:52:04
13099,726573,11,45235803,63',Daniel Bouman (Westchester SC) Substitution at 63',2025-05-12 04:52:04
13099,726573,12,45235880,70',Jon Bakero (Charlotte Independence) Substitution at 70',2025-05-12 04:52:04
13099,726573,13,45235903,73',Souaibou Marou (Charlotte Independence) Goal at 73',2025-05-12 04:52:04
13099,726573,14,45235938,75',Joel Johnson Alajarin (Westchester SC) Red Card at 75',2025-05-12 04:52:04
13099,726573,15,45235972,79',Bobby Pierre (Westchester SC) Substitution at 79',2025-05-12 04:52:04
13099,726573,16,45236182,88',Ermin Mackic (Westchester SC) Substitution at 88',2025-05-12 04:52:04
13099,726573,17,45236183,88',Christopher Jaime (Charlotte Independence) Substitution at 88',2025-05-12 04:52:04
13099,726573,18,45236184,89',Souaibou Marou (Charlotte Independence) Goal at 89',2025-05-12 04:52:04
13099,726573,19,45236204,90'+3',Pele Ousmanou (Charlotte Independence) Substitution at 93',2025-05-12 04:52:04
13099,726573,20,45236289,90'+6',Christian Chaney (Charlotte Independence) Yellow Card at 96',2025-05-12 04:52:04
13099,726574,0,45237455,32',Joshua Ramos (Chattanooga Red Wolves) Yellow Card at 32',2025-05-12 04:52:04
13099,726574,1,45237526,38',Declan Watters (Chattanooga Red Wolves) Yellow Card at 38',2025-05-12 04:52:04
13099,726574,2,45239460,45',Hayden Anderson (Richmond Kickers) Substitution at 45',2025-05-12 04:52:04
13099,726574,3,45239743,67',Wynand Wessels (Chattanooga Red Wolves) Substitution at 67',2025-05-12 04:52:04
13099,726574,4,45239744,67',Alhassan (Chattanooga Red Wolves) Substitution at 67',2025-05-12 04:52:04
13099,726574,5,45239853,70',Dakota Barnathan (Richmond Kickers) Yellow Card at 70',2025-05-12 04:52:04
13099,726574,6,45239854,70',Eric Kinzner (Chattanooga Red Wolves) Yellow Card at 70',2025-05-12 04:52:04
13099,726574,7,45239989,80',Jordan Ayimbila (Chattanooga Red Wolves) Substitution at 80',2025-05-12 04:52:04
13099,726574,8,45240030,80',Mathew Bolduc (Richmond Kickers) Substitution at 80',2025-05-12 04:52:04
13099,726574,9,45240001,81',Yanis Lelin (Chattanooga Red Wolves) Substitution at 81',2025-05-12 04:52:04
13099,726574,10,45240149,90',Zahir Vasquez (Chattanooga Red Wolves) Substitution at 90',2025-05-12 04:52:04
13099,726574,11,45240150,90',Jonathan Kanagwa (Richmond Kickers) Substitution at 90',2025-05-12 04:52:04
13099,726575,0,45240797,32',Maciej Bortniczuk (Texoma FC) Yellow Card at 32',2025-05-12 04:52:04
13099,726575,1,45240825,38',Reid Valentine (Texoma FC) Yellow Card at 38',2025-05-12 04:52:04
13099,726575,2,45241038,45',David Mason (Texoma FC) Substitution at 45',2025-05-12 04:52:04
13099,726575,3,45241152,64',Luke Mccormick (Texoma FC) Substitution at 64',2025-05-12 04:52:04
13099,726575,4,45241159,67',Adam Aoumaich (AV Alta FC) Substitution at 67',2025-05-12 04:52:04
13099,726575,5,45241168,68',David Mason (Texoma FC) Yellow Card at 68',2025-05-12 04:52:04
13099,726575,6,45241195,75',Alexis Cerritos (AV Alta FC) Substitution at 75',2025-05-12 04:52:04
13099,726575,7,45241201,75',Miguel Pajaro (AV Alta FC) Yellow Card at 75',2025-05-12 04:52:04
13099,726575,8,45241212,79',Javier Mariona (AV Alta FC) Substitution at 79',2025-05-12 04:52:04
