seasonType,eventId,commentaryOrder,playId,clockDisplayValue,commentaryText,updateDateTime
13260,732277,108,44905115,97',Attempt missed. Jonathan Mosquera (El Farolito) header from the centre of the box is too high following a set piece situation.,2025-03-20 04:56:27
13260,732277,109,44905124,99',Foul by Luca Moisa (Real Monarchs).,2025-03-20 04:56:27
13260,732277,110,44905124,99',Jhonatan Pérez (El Farolito) wins a free kick in the defensive half.,2025-03-20 04:56:27
13260,732277,111,44905159,101',Erik Arias (El Farolito) wins a free kick in the defensive half.,2025-03-20 04:56:27
13260,732277,112,44905159,101',Foul by Luca Moisa (Real Monarchs).,2025-03-20 04:56:27
13260,732277,113,44905161,102',"Corner, El Farolito. Conceded by Kobi Henry.",2025-03-20 04:56:27
13260,732277,114,44905163,103',Foul by Andrés Zuluaga (El Farolito).,2025-03-20 04:56:27
13260,732277,115,44905163,103',Noel Caliskan (Real Monarchs) wins a free kick in the defensive half.,2025-03-20 04:56:27
13260,732277,116,44905172,103',Dembor Benson (El Farolito) wins a free kick in the attacking half.,2025-03-20 04:56:27
13260,732277,117,44905172,103',Foul by Kobi Henry (Real Monarchs).,2025-03-20 04:56:27
13260,732277,118,44905173,104',Second yellow card to Kobi Henry (Real Monarchs) for a bad foul.,2025-03-20 04:56:27
13260,732277,119,-1,105',Fourth official has announced 3 minutes of added time.,2025-03-20 04:56:27
13260,732277,120,44905191,105'+2',Attempt blocked. Gabriel Arias (El Farolito) right footed shot from outside the box is blocked.,2025-03-20 04:56:27
13260,732277,121,44905197,105'+2',"Substitution, Real Monarchs. Loic Adjalala replaces Luca Moisa.",2025-03-20 04:56:27
13260,732277,122,44905205,105'+4',"First Half Extra Time ends, Real Monarchs 1, El Farolito 1.",2025-03-20 04:56:27
13260,732277,123,-1,105',"Second Half Extra Time begins Real Monarchs 1, El Farolito 1.",2025-03-20 04:56:27
13260,732277,124,44905221,107',Attempt saved. Chase Duke (Real Monarchs) right footed shot from the right side of the box is saved in the bottom right corner. Assisted by Noel Caliskan.,2025-03-20 04:56:27
13260,732277,125,44905230,107',"Corner, Real Monarchs. Conceded by Jorge Murillo.",2025-03-20 04:56:27
13260,732277,126,44905240,108',Foul by Loic Adjalala (Real Monarchs).,2025-03-20 04:56:27
13260,732277,127,44905240,108',Herlbert Soto (El Farolito) wins a free kick on the left wing.,2025-03-20 04:56:27
13260,732277,128,44905241,108',Loic Adjalala (Real Monarchs) is shown the yellow card for a bad foul.,2025-03-20 04:56:27
13260,732277,129,44905249,111',Attempt blocked. Noel Caliskan (Real Monarchs) left footed shot from outside the box is blocked. Assisted by Chase Duke.,2025-03-20 04:56:27
13260,732277,130,44905266,111',Penalty El Farolito. Herlbert Soto draws a foul in the penalty area.,2025-03-20 04:56:27
13260,732277,131,44905266,111',Penalty conceded by Loic Adjalala (Real Monarchs) after a foul in the penalty area.,2025-03-20 04:56:27
13260,732277,132,44905273,113',Noel Caliskan (Real Monarchs) is shown the yellow card.,2025-03-20 04:56:27
13260,732277,133,44905274,114',"Goal! Real Monarchs 1, El Farolito 2. Herlbert Soto (El Farolito) converts the penalty with a left footed shot to the top right corner.",2025-03-20 04:56:27
13260,732277,134,44905288,116',"Offside, El Farolito. Herlbert Soto is caught offside.",2025-03-20 04:56:27
13260,732277,135,44905301,117',"Substitution, El Farolito. Daouda Sidibe replaces Herlbert Soto.",2025-03-20 04:56:27
13260,732277,136,44905302,117',"Substitution, El Farolito. Omar Quiroga replaces Dembor Benson.",2025-03-20 04:56:27
13260,732277,137,44905311,118',Attempt saved. Daouda Sidibe (El Farolito) right footed shot from the centre of the box is saved in the bottom right corner.,2025-03-20 04:56:27
13260,732277,138,-1,119',"Corner, El Farolito. Conceded by Max Kerkvliet.",2025-03-20 04:56:27
13260,732277,139,44905314,120',"Corner, El Farolito. Conceded by Liam O'Gara.",2025-03-20 04:56:27
13260,732277,140,44905332,120',Attempt blocked. Antonio Riquelme (Real Monarchs) right footed shot from more than 35 yards is blocked. Assisted by Omar Marquez.,2025-03-20 04:56:27
13260,732277,141,-1,120',Fourth official has announced 6 minutes of added time.,2025-03-20 04:56:27
13260,732277,142,44905342,120'+1',Attempt missed. Liam O'Gara (Real Monarchs) header from the centre of the box misses to the right. Assisted by Zack Farnsworth with a cross.,2025-03-20 04:56:27
13260,732277,143,44905358,120'+1',Griffin Dillon (Real Monarchs) is shown the yellow card for a bad foul.,2025-03-20 04:56:27
13260,732277,144,44905343,120'+2',Foul by Jorge Murillo (El Farolito).,2025-03-20 04:56:27
13260,732277,145,44905343,120'+2',Zack Farnsworth (Real Monarchs) wins a free kick in the defensive half.,2025-03-20 04:56:27
13260,732277,146,44905359,120'+3',Foul by Jorge Murillo (El Farolito).,2025-03-20 04:56:27
13260,732277,147,44905359,120'+3',Noel Caliskan (Real Monarchs) wins a free kick on the right wing.,2025-03-20 04:56:27
13260,732277,148,44905369,120'+5',Attempt saved. Daouda Sidibe (El Farolito) left footed shot from the left side of the box is saved in the centre of the goal. Assisted by Johan Lizarralde.,2025-03-20 04:56:27
13260,732277,149,44905370,120'+5',"Goal! Real Monarchs 1, El Farolito 3. Erik Arias (El Farolito) right footed shot from the centre of the box to the centre of the goal.",2025-03-20 04:56:27
13260,732277,150,44905378,120'+6',"Second Half Extra Time ends, Real Monarchs 1, El Farolito 3.",2025-03-20 04:56:27
13260,732277,151,-1,,"Match ends, Real Monarchs 1, El Farolito 3.",2025-03-20 04:56:27
13260,732278,0,-1,,Lineups are announced and players are warming up.,2025-03-20 04:56:27
13260,732278,1,44904419,,First Half begins.,2025-03-20 04:56:27
13260,732278,2,44904432,2',"Goal! Monterey Bay 1, International San Francisco 0. Mobi Fehr (Monterey Bay) left footed shot from very close range to the bottom left corner. Assisted by Alex Dixon.",2025-03-20 04:56:27
13260,732278,3,44904447,4',Attempt missed. Matt Fondy (International San Francisco) right footed shot from the left side of the box misses to the left. Assisted by Pierre Rappolt.,2025-03-20 04:56:27
13260,732278,4,44904449,4',Dylan Autran (International San Francisco) wins a free kick on the left wing.,2025-03-20 04:56:27
13260,732278,5,44904449,4',Foul by Miles Lyons (Monterey Bay).,2025-03-20 04:56:27
13260,732278,6,44904457,5',Foul by Luke Ivanovic (Monterey Bay).,2025-03-20 04:56:27
13260,732278,7,44904457,5',Max Ornstil (International San Francisco) wins a free kick on the left wing.,2025-03-20 04:56:27
13260,732278,8,44904477,7',Attempt blocked. Dylan Autran (International San Francisco) header from the centre of the box is blocked.,2025-03-20 04:56:27
13260,732278,9,44904478,7',Attempt saved. Adrien Argast (International San Francisco) right footed shot from the right side of the box is saved in the centre of the goal. Assisted by Javier Rivera.,2025-03-20 04:56:27
13260,732278,10,44904480,8',Foul by Oscar Cervantes (International San Francisco).,2025-03-20 04:56:27
13260,732278,11,44904480,8',Joel Garcia Jr. (Monterey Bay) wins a free kick on the left wing.,2025-03-20 04:56:27
13260,732278,12,44904487,9',Foul by Pierre Rappolt (International San Francisco).,2025-03-20 04:56:27
13260,732278,13,44904487,9',Xavi Gnaulati (Monterey Bay) wins a free kick in the attacking half.,2025-03-20 04:56:27
13260,732278,14,44904501,10',Dylan Autran (International San Francisco) wins a free kick in the defensive half.,2025-03-20 04:56:27
13260,732278,15,44904501,10',Foul by Xavi Gnaulati (Monterey Bay).,2025-03-20 04:56:27
13260,732278,16,44904500,12',Foul by Oscar Shub (International San Francisco).,2025-03-20 04:56:27
13260,732278,17,44904500,12',Pierce Gallaway (Monterey Bay) wins a free kick on the right wing.,2025-03-20 04:56:27
13260,732278,18,44904526,16',Foul by Xavi Gnaulati (Monterey Bay).,2025-03-20 04:56:27
13260,732278,19,44904526,16',Max Ornstil (International San Francisco) wins a free kick in the defensive half.,2025-03-20 04:56:27
13260,732278,20,44904541,18',Foul by Javier Rivera (International San Francisco).,2025-03-20 04:56:27
13260,732278,21,44904541,18',Miles Lyons (Monterey Bay) wins a free kick in the attacking half.,2025-03-20 04:56:27
13260,732278,22,-1,18',Delay in match because of an injury Pierce Gallaway (Monterey Bay).,2025-03-20 04:56:27
13260,732278,23,-1,19',Delay over. They are ready to continue.,2025-03-20 04:56:27
13260,732278,24,44904553,19',Attempt missed. Ethan Bryant (Monterey Bay) right footed shot from outside the box is high and wide to the left from a direct free kick.,2025-03-20 04:56:27
13260,732278,25,44904554,20',Foul by Alex Dixon (Monterey Bay).,2025-03-20 04:56:27
13260,732278,26,44904554,20',Oscar Cervantes (International San Francisco) wins a free kick in the defensive half.,2025-03-20 04:56:27
13260,732278,27,44904562,21',Foul by Adrien Argast (International San Francisco).,2025-03-20 04:56:27
13260,732278,28,44904562,21',Joel Garcia Jr. (Monterey Bay) wins a free kick in the attacking half.,2025-03-20 04:56:27
13260,732278,29,44904563,21',Adrien Argast (International San Francisco) is shown the yellow card for a bad foul.,2025-03-20 04:56:27
13260,732278,30,44904566,22',Attempt missed. Carlos Guzmán (Monterey Bay) header from the centre of the box misses to the right. Assisted by Ethan Bryant with a cross following a set piece situation.,2025-03-20 04:56:27
13260,732278,31,44904575,25',"Offside, Monterey Bay. Xavi Gnaulati is caught offside.",2025-03-20 04:56:27
13260,732278,32,44904578,26',"Goal! Monterey Bay 2, International San Francisco 0. Xavi Gnaulati (Monterey Bay) left footed shot from the centre of the box to the centre of the goal. Assisted by Luke Ivanovic with a cross.",2025-03-20 04:56:27
13260,732278,33,44904594,28',Foul by Miles Lyons (Monterey Bay).,2025-03-20 04:56:27
13260,732278,34,44904594,28',Javier Rivera (International San Francisco) wins a free kick in the attacking half.,2025-03-20 04:56:27
13260,732278,35,44904595,28',Miles Lyons (Monterey Bay) is shown the yellow card for a bad foul.,2025-03-20 04:56:27
13260,732278,36,-1,28',Delay in match because of an injury Javier Rivera (International San Francisco).,2025-03-20 04:56:27
13260,732278,37,-1,29',Delay over. They are ready to continue.,2025-03-20 04:56:27
13260,732278,38,44904597,30',"Offside, Monterey Bay. Alex Dixon is caught offside.",2025-03-20 04:56:27
13260,732278,39,44904601,31',Attempt missed. Alex Dixon (Monterey Bay) right footed shot from outside the box misses to the right. Assisted by Ethan Bryant.,2025-03-20 04:56:27
13260,732278,40,-1,32',Delay in match because of an injury Carlos Guzmán (Monterey Bay).,2025-03-20 04:56:27
13260,732278,41,-1,32',Delay over. They are ready to continue.,2025-03-20 04:56:27
13260,732278,42,44904609,33',Foul by Miles Lyons (Monterey Bay).,2025-03-20 04:56:27
13260,732278,43,44904609,33',Jesús Enríquez (International San Francisco) wins a free kick in the defensive half.,2025-03-20 04:56:27
13260,732278,44,44904616,34',Foul by Jesús Enríquez (International San Francisco).,2025-03-20 04:56:27
13260,732278,45,44904616,34',Miles Lyons (Monterey Bay) wins a free kick in the defensive half.,2025-03-20 04:56:27
13260,732278,46,44904620,34',Attempt missed. Ethan Bryant (Monterey Bay) right footed shot from outside the box is high and wide to the right. Assisted by Xavi Gnaulati.,2025-03-20 04:56:27
13260,732278,47,44904653,36',Attempt missed. Jesús Enríquez (International San Francisco) right footed shot from outside the box is too high.,2025-03-20 04:56:27
13260,732278,48,44904667,37',Foul by Pierre Rappolt (International San Francisco).,2025-03-20 04:56:27
13260,732278,49,44904667,37',Xavi Gnaulati (Monterey Bay) wins a free kick in the attacking half.,2025-03-20 04:56:27
13260,732278,50,44904691,37',Pierre Rappolt (International San Francisco) is shown the yellow card for a bad foul.,2025-03-20 04:56:27
13260,732278,51,-1,37',Delay in match because of an injury Xavi Gnaulati (Monterey Bay).,2025-03-20 04:56:27
13260,732278,52,-1,38',Delay over. They are ready to continue.,2025-03-20 04:56:27
13260,732278,53,44904693,38',Attempt blocked. Alex Dixon (Monterey Bay) right footed shot from outside the box is blocked.,2025-03-20 04:56:27
13260,732278,54,44904714,39',"Attempt missed. Luke Ivanovic (Monterey Bay) right footed shot from very close range is close, but misses to the left. Assisted by Pierce Gallaway with a cross.",2025-03-20 04:56:27
13260,732278,55,44904695,39',Foul by Mobi Fehr (Monterey Bay).,2025-03-20 04:56:27
13260,732278,56,44904695,39',Oscar Shub (International San Francisco) wins a free kick in the defensive half.,2025-03-20 04:56:27
13260,732278,57,44904716,40',Foul by Jesús Enríquez (International San Francisco).,2025-03-20 04:56:27
13260,732278,58,44904716,40',Miles Lyons (Monterey Bay) wins a free kick in the defensive half.,2025-03-20 04:56:27
13260,732278,59,44904717,40',Jesús Enríquez (International San Francisco) is shown the yellow card for a bad foul.,2025-03-20 04:56:27
13260,732278,60,44904838,42',Attempt saved. Xavi Gnaulati (Monterey Bay) left footed shot from the centre of the box is saved in the top centre of the goal.,2025-03-20 04:56:27
13260,732278,61,44904751,44',Foul by Adrien Argast (International San Francisco).,2025-03-20 04:56:27
13260,732278,62,44904751,44',Pierce Gallaway (Monterey Bay) wins a free kick in the attacking half.,2025-03-20 04:56:27
13260,732278,63,-1,45',Delay in match because of an injury Pierce Gallaway (Monterey Bay).,2025-03-20 04:56:27
13260,732278,64,-1,45',Fourth official has announced 4 minutes of added time.,2025-03-20 04:56:27
13260,732278,65,-1,45'+1',Delay over. They are ready to continue.,2025-03-20 04:56:27
13260,732278,66,44904760,45'+2',"Goal! Monterey Bay 3, International San Francisco 0. Xavi Gnaulati (Monterey Bay) right footed shot from very close range to the bottom right corner. Assisted by Alex Dixon.",2025-03-20 04:56:27
13260,732278,67,44904795,45'+3',Ethan Bryant (Monterey Bay) hits the bar with a right footed shot from the centre of the box. Assisted by Joel Garcia Jr..,2025-03-20 04:56:27
13260,732278,68,44904773,45'+4',Foul by Alex Lara (Monterey Bay).,2025-03-20 04:56:27
13260,732278,69,44904773,45'+4',Matt Fondy (International San Francisco) wins a free kick in the defensive half.,2025-03-20 04:56:27
13260,732278,70,44904783,45'+4',"Offside, Monterey Bay. Xavi Gnaulati is caught offside.",2025-03-20 04:56:27
13260,732278,71,-1,45'+5',"First Half ends, Monterey Bay 3, International San Francisco 0.",2025-03-20 04:56:27
13260,732278,72,-1,45',"Second Half begins Monterey Bay 3, International San Francisco 0.",2025-03-20 04:56:27
13260,732278,73,44904918,45',"Substitution, International San Francisco. Julio Cervantes replaces Oscar Shub.",2025-03-20 04:56:27
13260,732278,74,44904897,45',"Substitution, International San Francisco. Nikolai Littleton replaces Oscar Cervantes.",2025-03-20 04:56:27
13260,732278,75,44904900,46',"Corner, Monterey Bay. Conceded by Max Ornstil.",2025-03-20 04:56:27
13260,732278,76,44904919,46',Attempt saved. Luke Ivanovic (Monterey Bay) right footed shot from the left side of the box is saved in the bottom left corner.,2025-03-20 04:56:27
13260,732278,77,44904901,46',"Offside, Monterey Bay. Pierce Gallaway is caught offside.",2025-03-20 04:56:27
13260,732278,78,44904944,49',Attempt missed. Matt Fondy (International San Francisco) right footed shot from outside the box is too high. Assisted by Nikolai Littleton.,2025-03-20 04:56:27
13260,732278,79,44904967,51',Attempt blocked. Mobi Fehr (Monterey Bay) left footed shot from outside the box is blocked.,2025-03-20 04:56:27
13260,732278,80,-1,51',"Corner, Monterey Bay. Conceded by Max Ornstil.",2025-03-20 04:56:27
13260,732278,81,44904969,52',Foul by Alex Lara (Monterey Bay).,2025-03-20 04:56:27
13260,732278,82,44904969,52',Matt Fondy (International San Francisco) wins a free kick in the defensive half.,2025-03-20 04:56:27
13260,732278,83,44904970,52',"Substitution, International San Francisco. Bryan Canchola replaces Pierre Rappolt.",2025-03-20 04:56:27
13260,732278,84,44905130,53',"Offside, Monterey Bay. Alex Dixon is caught offside.",2025-03-20 04:56:27
13260,732278,85,44905000,54',"Corner, International San Francisco. Conceded by Joel Garcia Jr..",2025-03-20 04:56:27
13260,732278,86,44905002,54',Attempt blocked. Julio Cervantes (International San Francisco) right footed shot from the centre of the box is blocked. Assisted by Dylan Autran with a cross.,2025-03-20 04:56:27
13260,732278,87,44905004,54',"Corner, International San Francisco. Conceded by Alex Lara.",2025-03-20 04:56:27
13260,732278,88,44905007,55',Attempt saved. Luke Ivanovic (Monterey Bay) right footed shot from the centre of the box is saved in the bottom right corner. Assisted by Xavi Gnaulati.,2025-03-20 04:56:27
13260,732278,89,44905010,55',"Corner, Monterey Bay. Conceded by Adrien Argast.",2025-03-20 04:56:27
13260,732278,90,44905011,56',"Offside, Monterey Bay. Alex Lara is caught offside.",2025-03-20 04:56:27
13260,732278,91,-1,58',"Corner, International San Francisco. Conceded by Miles Lyons.",2025-03-20 04:56:27
13260,732278,92,-1,59',Delay in match (Monterey Bay).,2025-03-20 04:56:27
13260,732278,93,-1,60',Delay over. They are ready to continue.,2025-03-20 04:56:27
13260,732278,94,44905045,61',"Substitution, Monterey Bay. Grant Robinson replaces Miles Lyons.",2025-03-20 04:56:27
13260,732278,95,44905046,61',"Substitution, Monterey Bay. Nicholas Gordon replaces Carlos Guzmán.",2025-03-20 04:56:27
13260,732278,96,44905047,61',"Substitution, Monterey Bay. Adrian Rebollar replaces Luke Ivanovic.",2025-03-20 04:56:27
13260,732278,97,44905048,62',Foul by Adrian Rebollar (Monterey Bay).,2025-03-20 04:56:27
13260,732278,98,44905239,62',Nikolai Littleton (International San Francisco) wins a free kick in the defensive half.,2025-03-20 04:56:27
13260,732278,99,44905057,65',"Offside, Monterey Bay. Xavi Gnaulati is caught offside.",2025-03-20 04:56:27
13260,732278,100,44905065,68',Dylan Autran (International San Francisco) wins a free kick in the attacking half.,2025-03-20 04:56:27
13260,732278,101,44905065,68',Foul by Nicholas Gordon (Monterey Bay).,2025-03-20 04:56:27
13260,732278,102,44905066,68',Nicholas Gordon (Monterey Bay) is shown the yellow card for a bad foul.,2025-03-20 04:56:27
13260,732278,103,44905067,70',"Attempt missed. Jesús Enríquez (International San Francisco) right footed shot from outside the box is close, but misses to the left from a direct free kick.",2025-03-20 04:56:27
13260,732278,104,44905072,70',"Substitution, International San Francisco. Florian Deletioglu replaces Javier Rivera.",2025-03-20 04:56:27
13260,732278,105,44905073,71',"Substitution, Monterey Bay. Ilijah Paul replaces Xavi Gnaulati.",2025-03-20 04:56:27
13260,732278,106,44905075,72',Foul by Adrien Argast (International San Francisco).,2025-03-20 04:56:27
13260,732278,107,44905075,72',Joel Garcia Jr. (Monterey Bay) wins a free kick in the defensive half.,2025-03-20 04:56:27
13260,732278,108,44905079,73',Attempt missed. Adrian Rebollar (Monterey Bay) right footed shot from the right side of the box misses to the left. Assisted by Mobi Fehr.,2025-03-20 04:56:27
13260,732278,109,44905095,76',Attempt saved. Alex Dixon (Monterey Bay) right footed shot from the left side of the box is saved in the centre of the goal. Assisted by Ilijah Paul.,2025-03-20 04:56:27
13260,732278,110,44905096,76',"Attempt missed. Adrian Rebollar (Monterey Bay) left footed shot from the centre of the box is close, but misses the top left corner.",2025-03-20 04:56:27
13260,732278,111,44905097,76',Foul by Alex Lara (Monterey Bay).,2025-03-20 04:56:27
13260,732278,112,44905097,76',Matt Fondy (International San Francisco) wins a free kick on the right wing.,2025-03-20 04:56:27
13260,732278,113,44905109,77',Attempt blocked. Dylan Autran (International San Francisco) right footed shot from outside the box is blocked. Assisted by Nikolai Littleton.,2025-03-20 04:56:27
13260,732278,114,44905111,78',Attempt blocked. Ilijah Paul (Monterey Bay) left footed shot from the right side of the box is blocked. Assisted by Grant Robinson with a cross.,2025-03-20 04:56:27
13260,732278,115,44905131,80',"Substitution, International San Francisco. Miles Montgomery replaces Nikolai Littleton because of an injury.",2025-03-20 04:56:27
13260,732278,116,44905133,80',"Offside, Monterey Bay. Ilijah Paul is caught offside.",2025-03-20 04:56:27
13260,732278,117,44905147,81',Attempt saved. Alex Dixon (Monterey Bay) right footed shot from the centre of the box is saved in the centre of the goal. Assisted by Ethan Bryant.,2025-03-20 04:56:27
13260,732278,118,44905148,81',Foul by Alex Lara (Monterey Bay).,2025-03-20 04:56:27
13260,732278,119,44905148,81',Matt Fondy (International San Francisco) wins a free kick in the attacking half.,2025-03-20 04:56:27
13260,732278,120,44905150,82',Attempt missed. Florian Deletioglu (International San Francisco) header from the centre of the box is too high. Assisted by Dylan Autran with a cross following a set piece situation.,2025-03-20 04:56:27
13260,732278,121,44905157,83',"Substitution, Monterey Bay. Anton Søjberg replaces Mobi Fehr.",2025-03-20 04:56:27
13260,732278,122,44905168,84',"Goal! Monterey Bay 4, International San Francisco 0. Ilijah Paul (Monterey Bay) header from the right side of the six yard box to the bottom right corner. Assisted by Adrian Rebollar with a cross.",2025-03-20 04:56:27
13260,732278,123,44905175,85',Ethan Bryant (Monterey Bay) wins a free kick in the defensive half.,2025-03-20 04:56:27
13260,732278,124,44905175,85',Foul by Dylan Autran (International San Francisco).,2025-03-20 04:56:27
13260,732278,125,44905183,86',Ethan Bryant (Monterey Bay) wins a free kick in the defensive half.,2025-03-20 04:56:27
13260,732278,126,44905183,86',Foul by Florian Deletioglu (International San Francisco).,2025-03-20 04:56:27
13260,732278,127,44905187,87',Attempt missed. Ethan Bryant (Monterey Bay) right footed shot from the centre of the box is high and wide to the right. Assisted by Joel Garcia Jr..,2025-03-20 04:56:27
13260,732278,128,44905204,89',"Corner, Monterey Bay. Conceded by Florian Deletioglu.",2025-03-20 04:56:27
13260,732278,129,44905231,90',Foul by Ilijah Paul (Monterey Bay).,2025-03-20 04:56:27
13260,732278,130,44905231,90',Jesus Medina (International San Francisco) wins a free kick in the defensive half.,2025-03-20 04:56:27
13260,732278,131,-1,90'+1',Fourth official has announced 2 minutes of added time.,2025-03-20 04:56:27
13260,732278,132,44905215,90'+1',"Corner, Monterey Bay. Conceded by Bryan Canchola.",2025-03-20 04:56:27
13260,732278,133,44905223,90'+2',Foul by Alex Lara (Monterey Bay).,2025-03-20 04:56:27
13260,732278,134,44905223,90'+2',Jesus Medina (International San Francisco) wins a free kick in the defensive half.,2025-03-20 04:56:27
13260,732278,135,44905227,90'+3',"Second Half ends, Monterey Bay 4, International San Francisco 0.",2025-03-20 04:56:27
13260,732278,136,-1,,"Match ends, Monterey Bay 4, International San Francisco 0.",2025-03-20 04:56:27
13260,732279,0,-1,,Lineups are announced and players are warming up.,2025-03-19 04:54:57
13260,732279,1,44901187,,First Half begins.,2025-03-19 04:54:57
13260,732279,2,44901231,5',Attempt saved. Jason Bucknor (Ventura County) left footed shot from more than 35 yards is saved in the centre of the goal. Assisted by Aaron Bibout.,2025-03-19 04:54:57
13260,732279,3,44901233,5',Attempt missed. Dylan Vanney (Ventura County) right footed shot from outside the box misses to the left. Assisted by Luis Müller.,2025-03-19 04:54:57
13260,732279,4,44901250,9',"Corner, Ventura County. Conceded by Tanner Casey.",2025-03-19 04:54:57
13260,732279,5,44901257,9',Foul by Dylan Vanney (Ventura County).,2025-03-19 04:54:57
13260,732279,6,44901257,9',Hector Flores (Laguna United) wins a free kick in the defensive half.,2025-03-19 04:54:57
13260,732279,7,44901279,12',Foul by Tommy Musto (Ventura County).,2025-03-19 04:54:57
13260,732279,8,44901279,12',Vincent Lopez (Laguna United) wins a free kick in the defensive half.,2025-03-19 04:54:57
13260,732279,9,44901281,13',"Corner, Ventura County. Conceded by Tanner Casey.",2025-03-19 04:54:57
13260,732279,10,44901294,14',Attempt saved. Chris Rindov (Ventura County) header from the centre of the box is saved in the top centre of the goal. Assisted by Luis Müller with a cross.,2025-03-19 04:54:57
13260,732279,11,44901295,14',Foul by Ascel Essengue (Ventura County).,2025-03-19 04:54:57
13260,732279,12,44901295,14',Michael Barraza (Laguna United) wins a free kick in the defensive half.,2025-03-19 04:54:57
13260,732279,13,44901310,17',Attempt saved. Sean Karani (Ventura County) right footed shot from the right side of the box is saved in the centre of the goal. Assisted by Jeorgio Kocevski.,2025-03-19 04:54:57
13260,732279,14,44901311,17',"Corner, Ventura County. Conceded by Hector Flores.",2025-03-19 04:54:57
13260,732279,15,44901314,18',"Goal! Ventura County 1, Laguna United 0. Ascel Essengue (Ventura County) left footed shot from the centre of the box to the bottom right corner. Assisted by Luis Müller with a cross following a corner.",2025-03-19 04:54:57
13260,732279,16,44901315,21',"Corner, Ventura County. Conceded by Tanner Casey.",2025-03-19 04:54:57
13260,732279,17,44901316,21',Ben Nicholson (Laguna United) wins a free kick in the defensive half.,2025-03-19 04:54:57
13260,732279,18,44901316,21',Foul by Ascel Essengue (Ventura County).,2025-03-19 04:54:57
13260,732279,19,44901320,22',Attempt saved. Aaron Bibout (Ventura County) right footed shot from outside the box is saved in the bottom right corner. Assisted by Jeorgio Kocevski.,2025-03-19 04:54:57
13260,732279,20,44901321,23',Attempt missed. Luis Müller (Ventura County) left footed shot from outside the box is high and wide to the left. Assisted by Jeorgio Kocevski.,2025-03-19 04:54:57
