seasonType,eventId,commentaryOrder,playId,clockDisplayValue,commentaryText,updateDateTime
13260,732264,39,44899574,37',"Goal! West Chester Predators 1, Loudoun United 1. Riley Bidois (Loudoun United) left footed shot from the left side of the six yard box to the bottom left corner. Assisted by Ben Mines.",2025-03-19 04:54:57
13260,732264,40,44899592,38',Foul by Aaron Hurge (Loudoun United).,2025-03-19 04:54:57
13260,732264,41,44899592,38',Yassine Elkahloun (West Chester Predators) wins a free kick in the defensive half.,2025-03-19 04:54:57
13260,732264,42,44899626,40',Foul by Keegan Tingey (Loudoun United).,2025-03-19 04:54:57
13260,732264,43,44899626,40',Joshua Luchini (West Chester Predators) wins a free kick in the defensive half.,2025-03-19 04:54:57
13260,732264,44,44899636,41',Attempt saved. Ayoub Mouhou (West Chester Predators) left footed shot from more than 35 yards is saved in the top right corner. Assisted by Marcus Brenes.,2025-03-19 04:54:57
13260,732264,45,44899645,42',Foul by Jacob Erlandson (Loudoun United).,2025-03-19 04:54:57
13260,732264,46,44899645,42',Joshua Luchini (West Chester Predators) wins a free kick in the defensive half.,2025-03-19 04:54:57
13260,732264,47,44899682,43',Dylan Lacy (West Chester Predators) wins a free kick in the attacking half.,2025-03-19 04:54:57
13260,732264,48,44899682,43',Foul by Moses Nyeman (Loudoun United).,2025-03-19 04:54:57
13260,732264,49,44899685,44',"Offside, West Chester Predators. Joshua Luchini is caught offside.",2025-03-19 04:54:57
13260,732264,50,-1,45'+1',Fourth official has announced 1 minutes of added time.,2025-03-19 04:54:57
13260,732264,51,44899715,45'+1',Ayoub Mouhou (West Chester Predators) wins a free kick in the defensive half.,2025-03-19 04:54:57
13260,732264,52,44899715,45'+1',Foul by Christian Sorto (Loudoun United).,2025-03-19 04:54:57
13260,732264,53,44899733,45'+1',"First Half ends, West Chester Predators 1, Loudoun United 1.",2025-03-19 04:54:57
13260,732264,54,-1,45',"Second Half begins West Chester Predators 1, Loudoun United 1.",2025-03-19 04:54:57
13260,732264,55,44899906,48',Penalty Loudoun United. Riley Bidois draws a foul in the penalty area.,2025-03-19 04:54:57
13260,732264,56,44899906,48',Penalty conceded by Yassine Elkahloun (West Chester Predators) after a foul in the penalty area.,2025-03-19 04:54:57
13260,732264,57,44899925,49',"Goal! West Chester Predators 1, Loudoun United 2. Christian Sorto (Loudoun United) converts the penalty with a right footed shot to the bottom right corner.",2025-03-19 04:54:57
13260,732264,58,44899950,51',Ayoub Mouhou (West Chester Predators) wins a free kick in the attacking half.,2025-03-19 04:54:57
13260,732264,59,44899950,51',Foul by Jacob Erlandson (Loudoun United).,2025-03-19 04:54:57
13260,732264,60,44899992,53',"Corner, West Chester Predators. Conceded by Aaron Hurge.",2025-03-19 04:54:57
13260,732264,61,44899994,54',"Corner, West Chester Predators. Conceded by Alex Nagy.",2025-03-19 04:54:57
13260,732264,62,44900014,55',Attempt saved. Dylan Lacy (West Chester Predators) right footed shot from outside the box is saved in the bottom left corner.,2025-03-19 04:54:57
13260,732264,63,44900057,56',"Substitution, Loudoun United. Yanis Leerman replaces Keegan Tingey.",2025-03-19 04:54:57
13260,732264,64,44900084,58',Ben Mines (Loudoun United) wins a free kick in the defensive half.,2025-03-19 04:54:57
13260,732264,65,44900084,58',Foul by Patrick Short (West Chester Predators).,2025-03-19 04:54:57
13260,732264,66,44900086,58',Foul by Moses Nyeman (Loudoun United).,2025-03-19 04:54:57
13260,732264,67,44900086,58',Yassine Elkahloun (West Chester Predators) wins a free kick on the left wing.,2025-03-19 04:54:57
13260,732264,68,44900087,59',Moses Nyeman (Loudoun United) is shown the yellow card.,2025-03-19 04:54:57
13260,732264,69,44900124,60',Attempt blocked. Riley Bidois (Loudoun United) right footed shot from the centre of the box is blocked. Assisted by Ben Mines.,2025-03-19 04:54:57
13260,732264,70,44900120,61',"Goal! West Chester Predators 1, Loudoun United 3. Riley Bidois (Loudoun United) left footed shot from the left side of the box to the bottom right corner. Assisted by Surafel Dagnachew.",2025-03-19 04:54:57
13260,732264,71,44900143,63',Attempt blocked. Dylan Lacy (West Chester Predators) right footed shot from the left side of the box is blocked. Assisted by Patrick Short.,2025-03-19 04:54:57
13260,732264,72,-1,63',"Corner, West Chester Predators. Conceded by Ethan Pendleton.",2025-03-19 04:54:57
13260,732264,73,44900396,65',"Substitution, Loudoun United. Zach Ryan replaces Riley Bidois.",2025-03-19 04:54:57
13260,732264,74,44900397,65',"Substitution, Loudoun United. Kwame Awuah replaces Jacob Erlandson.",2025-03-19 04:54:57
13260,732264,75,44900433,67',"Offside, Loudoun United. Ben Mines is caught offside.",2025-03-19 04:54:57
13260,732264,76,44900442,68',"Goal! West Chester Predators 2, Loudoun United 3. Kenneth Roby (West Chester Predators) right footed shot from the right side of the box to the bottom left corner. Assisted by Ayoub Mouhou with a through ball.",2025-03-19 04:54:57
13260,732264,77,-1,69',Delay in match because of an injury Surafel Dagnachew (Loudoun United).,2025-03-19 04:54:57
13260,732264,78,-1,70',Delay over. They are ready to continue.,2025-03-19 04:54:57
13260,732264,79,44900491,71',"Substitution, Loudoun United. Abdellatif Aboukoura replaces Surafel Dagnachew because of an injury.",2025-03-19 04:54:57
13260,732264,80,44900508,72',"Substitution, West Chester Predators. Bobby Hickerson replaces Ayoub Mouhou.",2025-03-19 04:54:57
13260,732264,81,44900509,72',"Substitution, West Chester Predators. Tomas Ascoli replaces Patrick Short.",2025-03-19 04:54:57
13260,732264,82,44900511,73',Alex Nagy (Loudoun United) wins a free kick on the left wing.,2025-03-19 04:54:57
13260,732264,83,44900511,73',Foul by Yassine Elkahloun (West Chester Predators).,2025-03-19 04:54:57
13260,732264,84,44900520,73',Yassine Elkahloun (West Chester Predators) is shown the yellow card for a bad foul.,2025-03-19 04:54:57
13260,732264,85,44900559,77',Ben Mines (Loudoun United) wins a free kick in the defensive half.,2025-03-19 04:54:57
13260,732264,86,44900559,77',Foul by Bobby Hickerson (West Chester Predators).,2025-03-19 04:54:57
13260,732264,87,44900560,78',"Substitution, Loudoun United. Wesley Leggett replaces Alex Nagy.",2025-03-19 04:54:57
13260,732264,88,44900573,79',Foul by Abdellatif Aboukoura (Loudoun United).,2025-03-19 04:54:57
13260,732264,89,44900573,79',John-Austin Ricks (West Chester Predators) wins a free kick in the defensive half.,2025-03-19 04:54:57
13260,732264,90,44900593,80',"Substitution, West Chester Predators. Ori Arzi replaces Joshua Luchini.",2025-03-19 04:54:57
13260,732264,91,44900594,80',"Substitution, West Chester Predators. Giancarlo Vaccaro replaces Yassine Elkahloun.",2025-03-19 04:54:57
13260,732264,92,44900597,80',"Corner, West Chester Predators. Conceded by Moses Nyeman.",2025-03-19 04:54:57
13260,732264,93,-1,81',Delay in match because of an injury Moses Nyeman (Loudoun United).,2025-03-19 04:54:57
13260,732264,94,-1,82',Delay over. They are ready to continue.,2025-03-19 04:54:57
13260,732264,95,44900614,84',Attempt missed. Marcus Brenes (West Chester Predators) right footed shot from outside the box is high and wide to the right. Assisted by Bobby Hickerson.,2025-03-19 04:54:57
13260,732264,96,44900628,84',Christian Sorto (Loudoun United) wins a free kick in the attacking half.,2025-03-19 04:54:57
13260,732264,97,44900628,84',Foul by John-Austin Ricks (West Chester Predators).,2025-03-19 04:54:57
13260,732264,98,44900679,87',"Corner, West Chester Predators. Conceded by Wesley Leggett.",2025-03-19 04:54:57
13260,732264,99,44900681,87',Attempt missed. Kenneth Roby (West Chester Predators) right footed shot from outside the box is high and wide to the right. Assisted by Ori Arzi with a headed pass following a corner.,2025-03-19 04:54:57
13260,732264,100,44900682,88',"Substitution, West Chester Predators. Sama Tima replaces Marcus Brenes.",2025-03-19 04:54:57
13260,732264,101,44900683,88',"Substitution, West Chester Predators. Luca Mellor replaces Kenneth Roby.",2025-03-19 04:54:57
13260,732264,102,44900684,89',Bobby Hickerson (West Chester Predators) wins a free kick in the defensive half.,2025-03-19 04:54:57
13260,732264,103,44900684,89',Foul by Zach Ryan (Loudoun United).,2025-03-19 04:54:57
13260,732264,104,44900706,90',Attempt blocked. Luca Mellor (West Chester Predators) header from the centre of the box is blocked. Assisted by Dylan Lacy with a cross.,2025-03-19 04:54:57
13260,732264,105,44900709,90',"Corner, West Chester Predators. Conceded by Kwame Awuah.",2025-03-19 04:54:57
13260,732264,106,44900711,90',Attempt missed. John-Austin Ricks (West Chester Predators) header from the right side of the six yard box is too high. Assisted by Dylan Lacy with a cross following a corner.,2025-03-19 04:54:57
13260,732264,107,44900712,90',Foul by Sama Tima (West Chester Predators).,2025-03-19 04:54:57
13260,732264,108,-1,90',Fourth official has announced 5 minutes of added time.,2025-03-19 04:54:57
13260,732264,109,44900712,90',Wesley Leggett (Loudoun United) wins a free kick in the attacking half.,2025-03-19 04:54:57
13260,732264,110,44900714,90'+1',Abdellatif Aboukoura (Loudoun United) wins a free kick on the left wing.,2025-03-19 04:54:57
13260,732264,111,44900714,90'+1',Foul by Sama Tima (West Chester Predators).,2025-03-19 04:54:57
13260,732264,112,44900727,90'+2',Attempt saved. John-Austin Ricks (West Chester Predators) left footed shot from outside the box is saved in the bottom left corner.,2025-03-19 04:54:57
13260,732264,113,44900751,90'+3',Foul by Bobby Hickerson (West Chester Predators).,2025-03-19 04:54:57
13260,732264,114,44900751,90'+3',Wesley Leggett (Loudoun United) wins a free kick in the defensive half.,2025-03-19 04:54:57
13260,732264,115,44900753,90'+4',Bobby Hickerson (West Chester Predators) wins a free kick in the defensive half.,2025-03-19 04:54:57
13260,732264,116,44900753,90'+4',Foul by Wesley Leggett (Loudoun United).,2025-03-19 04:54:57
13260,732264,117,44900771,90'+5',Foul by Ben Mines (Loudoun United).,2025-03-19 04:54:57
13260,732264,118,44900771,90'+5',Giancarlo Vaccaro (West Chester Predators) wins a free kick in the defensive half.,2025-03-19 04:54:57
13260,732264,119,44900796,90'+6',Giancarlo Vaccaro (West Chester Predators) is shown the yellow card.,2025-03-19 04:54:57
13260,732264,120,44900772,90'+6',Ben Mines (Loudoun United) is shown the yellow card for a bad foul.,2025-03-19 04:54:57
13260,732264,121,44900798,90'+7',Andrew Cooke (West Chester Predators) is shown the yellow card.,2025-03-19 04:54:57
13260,732264,122,-1,90'+7',"Second Half ends, West Chester Predators 2, Loudoun United 3.",2025-03-19 04:54:57
13260,732264,123,-1,,"Match ends, West Chester Predators 2, Loudoun United 3.",2025-03-19 04:54:57
13260,732265,0,-1,,Lineups are announced and players are warming up.,2025-03-19 04:54:57
13260,732265,1,-1,,First Half begins.,2025-03-19 04:54:57
13260,732265,2,44899563,3',"Corner, Texoma. Conceded by Rio Ramirez.",2025-03-19 04:54:57
13260,732265,3,44899594,6',"Corner, Texoma. Conceded by Rio Ramirez.",2025-03-19 04:54:57
13260,732265,4,44899595,7',Foul by Jon Jordan (Texoma).,2025-03-19 04:54:57
13260,732265,5,44899595,7',Luis Lara (Foro) wins a free kick in the defensive half.,2025-03-19 04:54:57
13260,732265,6,44899611,8',Foul by Nate Kopetsky (Foro).,2025-03-19 04:54:57
13260,732265,7,44899611,8',Philip Spengler (Texoma) wins a free kick in the defensive half.,2025-03-19 04:54:57
13260,732265,8,44899629,9',"Attempt missed. Marcelo Pedraza (Foro) right footed shot from the centre of the box is close, but misses the top right corner. Assisted by Braden Anderson with a cross.",2025-03-19 04:54:57
13260,732265,9,44899630,9',Foul by Braden Anderson (Foro).,2025-03-19 04:54:57
13260,732265,10,44899630,9',Lamin Jawneh (Texoma) wins a free kick in the defensive half.,2025-03-19 04:54:57
13260,732265,11,44899633,10',Attempt missed. Brandon McManus (Texoma) right footed shot from the centre of the box misses to the right. Assisted by Lamin Jawneh with a cross.,2025-03-19 04:54:57
13260,732265,12,44899648,11',"Corner, Texoma. Conceded by Gonzalo Santa.",2025-03-19 04:54:57
13260,732265,13,44899750,11',Attempt blocked. Brandon McManus (Texoma) left footed shot from very close range is blocked. Assisted by Philip Spengler with a cross.,2025-03-19 04:54:57
13260,732265,14,44899751,11',Attempt saved. Jordan Chavez (Texoma) left footed shot from the centre of the box is saved in the bottom right corner.,2025-03-19 04:54:57
13260,732265,15,44899689,11',"Offside, Texoma. Preston Kilwien is caught offside.",2025-03-19 04:54:57
13260,732265,16,44899692,12',Hand ball by Braden Anderson (Foro).,2025-03-19 04:54:57
13260,732265,17,44899694,13',"Attempt missed. Philip Spengler (Texoma) left footed shot from the left side of the box is close, but misses to the right. Assisted by Jon Jordan following a fast break.",2025-03-19 04:54:57
13260,732265,18,44899708,14',Foul by Jordan Chavez (Texoma).,2025-03-19 04:54:57
13260,732265,19,44899708,14',Marcelo Pedraza (Foro) wins a free kick in the defensive half.,2025-03-19 04:54:57
13260,732265,20,-1,14',Penalty conceded by Will Perkins (Texoma) with a hand ball in the penalty area.,2025-03-19 04:54:57
13260,732265,21,44899722,15',"Goal! Texoma 0, Foro 1. Brayan Padilla (Foro) converts the penalty with a left footed shot to the bottom left corner.",2025-03-19 04:54:57
13260,732265,22,-1,17',"Corner, Texoma. Conceded by Thomas Robinson.",2025-03-19 04:54:57
13260,732265,23,44899773,18',Foul by Brandon McManus (Texoma).,2025-03-19 04:54:57
13260,732265,24,44899773,18',Rio Ramirez (Foro) wins a free kick in the defensive half.,2025-03-19 04:54:57
13260,732265,25,44899776,19',"Offside, Texoma. Brandon McManus is caught offside.",2025-03-19 04:54:57
13260,732265,26,44899792,20',Foul by Philip Spengler (Texoma).,2025-03-19 04:54:57
13260,732265,27,44899792,20',Nate Kopetsky (Foro) wins a free kick in the defensive half.,2025-03-19 04:54:57
13260,732265,28,44899804,21',Foul by Luis Lara (Foro).,2025-03-19 04:54:57
13260,732265,29,44899804,21',Ozzie Ramos (Texoma) wins a free kick in the defensive half.,2025-03-19 04:54:57
13260,732265,30,44899824,24',Foul by Imanol Almaguer (Foro).,2025-03-19 04:54:57
13260,732265,31,44899824,24',Jon Jordan (Texoma) wins a free kick in the attacking half.,2025-03-19 04:54:57
13260,732265,32,44899865,25',Attempt blocked. Philip Spengler (Texoma) left footed shot from outside the box is blocked.,2025-03-19 04:54:57
13260,732265,33,44899843,25',"Corner, Texoma. Conceded by Gonzalo Santa.",2025-03-19 04:54:57
13260,732265,34,44899844,26',Brayan Padilla (Foro) wins a free kick in the attacking half.,2025-03-19 04:54:57
13260,732265,35,44899844,26',Foul by Ozzie Ramos (Texoma).,2025-03-19 04:54:57
13260,732265,36,44899845,26',Ozzie Ramos (Texoma) is shown the red card.,2025-03-19 04:54:57
13260,732265,37,44899853,27',Foul by Kyran Pinho (Foro).,2025-03-19 04:54:57
13260,732265,38,44899853,27',Reid Valentine (Texoma) wins a free kick in the defensive half.,2025-03-19 04:54:57
13260,732265,39,44899855,27',Foul by Diego Pepi (Texoma).,2025-03-19 04:54:57
13260,732265,40,44899855,27',Kyran Pinho (Foro) wins a free kick in the defensive half.,2025-03-19 04:54:57
13260,732265,41,44899887,30',Foul by Braden Anderson (Foro).,2025-03-19 04:54:57
13260,732265,42,44899887,30',Lamin Jawneh (Texoma) wins a free kick on the left wing.,2025-03-19 04:54:57
13260,732265,43,-1,31',Delay in match because of an injury Mason McCready (Texoma).,2025-03-19 04:54:57
13260,732265,44,-1,33',Delay over. They are ready to continue.,2025-03-19 04:54:57
13260,732265,45,44899918,34',Foul by Jordan Chavez (Texoma).,2025-03-19 04:54:57
13260,732265,46,44899918,34',Gibran Rayo (Foro) wins a free kick in the defensive half.,2025-03-19 04:54:57
13260,732265,47,44899932,35',Attempt saved. Diego Pepi (Texoma) right footed shot from the centre of the box is saved in the bottom right corner. Assisted by Will Perkins.,2025-03-19 04:54:57
13260,732265,48,44899934,35',"Corner, Texoma. Conceded by Gonzalo Santa.",2025-03-19 04:54:57
13260,732265,49,44899936,36',"Corner, Texoma. Conceded by Nate Kopetsky.",2025-03-19 04:54:57
13260,732265,50,-1,37',Delay in match (Foro).,2025-03-19 04:54:57
13260,732265,51,-1,39',Delay over. They are ready to continue.,2025-03-19 04:54:57
13260,732265,52,44899999,40',Foul by Luis Lara (Foro).,2025-03-19 04:54:57
13260,732265,53,44899999,40',Will Perkins (Texoma) wins a free kick in the defensive half.,2025-03-19 04:54:57
13260,732265,54,44900000,41',Luis Lara (Foro) is shown the yellow card for a bad foul.,2025-03-19 04:54:57
13260,732265,55,44900518,42',"Offside, Foro. Luis Lara is caught offside.",2025-03-19 04:54:57
13260,732265,56,44900067,43',Foul by Nate Kopetsky (Foro).,2025-03-19 04:54:57
13260,732265,57,44900067,43',Lamin Jawneh (Texoma) wins a free kick on the left wing.,2025-03-19 04:54:57
13260,732265,58,44900068,43',Nate Kopetsky (Foro) is shown the red card for violent conduct.,2025-03-19 04:54:57
13260,732265,59,44900069,44',Preston Kilwien (Texoma) is shown the yellow card.,2025-03-19 04:54:57
13260,732265,60,-1,45'+1',Fourth official has announced 5 minutes of added time.,2025-03-19 04:54:57
13260,732265,61,44900135,45'+1',Attempt blocked. Gibran Rayo (Foro) right footed shot from the right side of the box is blocked. Assisted by Luis Lara.,2025-03-19 04:54:57
13260,732265,62,44900136,45'+2',Foul by Philip Spengler (Texoma).,2025-03-19 04:54:57
13260,732265,63,44900136,45'+2',Rio Ramirez (Foro) wins a free kick in the defensive half.,2025-03-19 04:54:57
13260,732265,64,44900137,45'+3',Philip Spengler (Texoma) is shown the yellow card for a bad foul.,2025-03-19 04:54:57
13260,732265,65,44900139,45'+4',Attempt missed. Lamin Jawneh (Texoma) left footed shot from outside the box is just a bit too high. Assisted by Diego Pepi.,2025-03-19 04:54:57
13260,732265,66,44900164,45'+5',"Offside, Texoma. Diego Pepi is caught offside.",2025-03-19 04:54:57
13260,732265,67,44900410,45'+6',Brandon McManus (Texoma) wins a free kick in the attacking half.,2025-03-19 04:54:57
13260,732265,68,44900410,45'+6',Foul by Marcelo Pedraza (Foro).,2025-03-19 04:54:57
13260,732265,69,44900415,45'+7',Foul by Jordan Chavez (Texoma).,2025-03-19 04:54:57
13260,732265,70,44900415,45'+7',Rio Ramirez (Foro) wins a free kick in the defensive half.,2025-03-19 04:54:57
13260,732265,71,44900416,45'+7',Jordan Chavez (Texoma) is shown the yellow card for a bad foul.,2025-03-19 04:54:57
13260,732265,72,-1,45'+7',"First Half ends, Texoma 0, Foro 1.",2025-03-19 04:54:57
13260,732265,73,44900622,45',"Second Half begins Texoma 0, Foro 1.",2025-03-19 04:54:57
13260,732265,74,44900642,48',Foul by Will Perkins (Texoma).,2025-03-19 04:54:57
13260,732265,75,44900642,48',Kyran Pinho (Foro) wins a free kick in the defensive half.,2025-03-19 04:54:57
13260,732265,76,44900651,49',Foul by Rio Ramirez (Foro).,2025-03-19 04:54:57
13260,732265,77,44900651,49',Jon Jordan (Texoma) wins a free kick in the defensive half.,2025-03-19 04:54:57
13260,732265,78,44900662,51',Foul by Braden Anderson (Foro).,2025-03-19 04:54:57
13260,732265,79,44900662,51',Lamin Jawneh (Texoma) wins a free kick in the defensive half.,2025-03-19 04:54:57
13260,732265,80,44900687,51',"Offside, Texoma. Brandon McManus is caught offside.",2025-03-19 04:54:57
13260,732265,81,44900692,52',Foul by Diego Pepi (Texoma).,2025-03-19 04:54:57
13260,732265,82,44900692,52',Rio Ramirez (Foro) wins a free kick in the defensive half.,2025-03-19 04:54:57
13260,732265,83,44900718,54',Attempt missed. Gibran Rayo (Foro) right footed shot from outside the box is high and wide to the right. Assisted by Luis Lara.,2025-03-19 04:54:57
13260,732265,84,44900760,57',"Offside, Texoma. Diego Pepi is caught offside.",2025-03-19 04:54:57
13260,732265,85,44900775,57',Foul by Preston Kilwien (Texoma).,2025-03-19 04:54:57
13260,732265,86,44900775,57',Gibran Rayo (Foro) wins a free kick in the defensive half.,2025-03-19 04:54:57
13260,732265,87,44900778,58',"Attempt missed. Brayan Padilla (Foro) left footed shot from outside the box is close, but misses the top right corner. Assisted by Imanol Almaguer following a set piece situation.",2025-03-19 04:54:57
13260,732265,88,44900791,59',"Goal! Texoma 1, Foro 1. Brandon McManus (Texoma) right footed shot from the centre of the box to the bottom left corner. Assisted by Lamin Jawneh.",2025-03-19 04:54:57
13260,732265,89,44900806,61',"Substitution, Foro. Manuel Lopez replaces Marcelo Pedraza.",2025-03-19 04:54:57
13260,732265,90,44900809,61',"Substitution, Foro. McKinley Smith replaces Braden Anderson.",2025-03-19 04:54:57
13260,732265,91,44900833,65',"Substitution, Texoma. Angelo Calfo replaces Philip Spengler.",2025-03-19 04:54:57
13260,732265,92,44900917,65',Attempt blocked. Manuel Lopez (Foro) right footed shot from outside the box is blocked.,2025-03-19 04:54:57
13260,732265,93,44900835,66',"Offside, Texoma. Lamin Jawneh is caught offside.",2025-03-19 04:54:57
13260,732265,94,44900850,67',Foul by Angelo Calfo (Texoma).,2025-03-19 04:54:57
13260,732265,95,44900850,67',Gibran Rayo (Foro) wins a free kick on the left wing.,2025-03-19 04:54:57
13260,732265,96,44900853,68',Attempt missed. Luis Lara (Foro) right footed shot from outside the box is high and wide to the right. Assisted by Imanol Almaguer following a set piece situation.,2025-03-19 04:54:57
13260,732265,97,44900855,68',Foul by Angelo Calfo (Texoma).,2025-03-19 04:54:57
13260,732265,98,44900855,68',Imanol Almaguer (Foro) wins a free kick in the defensive half.,2025-03-19 04:54:57
13260,732265,99,44900866,69',"Offside, Foro. Gibran Rayo is caught offside.",2025-03-19 04:54:57
13260,732265,100,-1,70',Delay in match (Texoma).,2025-03-19 04:54:57
13260,732265,101,-1,71',Delay over. They are ready to continue.,2025-03-19 04:54:57
13260,732265,102,44900886,72',Attempt saved. Lamin Jawneh (Texoma) right footed shot from outside the box is saved in the top centre of the goal. Assisted by Diego Pepi.,2025-03-19 04:54:57
13260,732265,103,44900887,72',Foul by Luis Lara (Foro).,2025-03-19 04:54:57
13260,732265,104,44900887,72',Jordan Chavez (Texoma) wins a free kick in the defensive half.,2025-03-19 04:54:57
13260,732265,105,44900895,73',Attempt blocked. Luis Lara (Foro) right footed shot from the left side of the box is blocked. Assisted by Gibran Rayo.,2025-03-19 04:54:57
13260,732265,106,44900897,74',Attempt saved. Manuel Lopez (Foro) right footed shot from outside the box is saved in the top right corner. Assisted by Brayan Padilla.,2025-03-19 04:54:57
13260,732265,107,44900899,74',"Corner, Foro. Conceded by Mason McCready.",2025-03-19 04:54:57
13260,732265,108,-1,74',"Corner, Foro. Conceded by Jon Jordan.",2025-03-19 04:54:57
13260,732265,109,44900902,75',"Corner, Texoma. Conceded by McKinley Smith.",2025-03-19 04:54:57
13260,732265,110,44900920,76',Attempt blocked. Jordan Chavez (Texoma) header from the centre of the box is blocked. Assisted by Will Perkins with a cross.,2025-03-19 04:54:57
13260,732265,111,44900921,76',"Offside, Texoma. Angelo Calfo is caught offside.",2025-03-19 04:54:57
13260,732265,112,44900922,77',"Substitution, Foro. Fabricio Martinez replaces Luis Lara.",2025-03-19 04:54:57
13260,732265,113,44900923,77',"Substitution, Texoma. Solomon Asanté replaces Brandon McManus.",2025-03-19 04:54:57
13260,732265,114,44900937,80',Foul by Fabricio Martinez (Foro).,2025-03-19 04:54:57
13260,732265,115,44900937,80',Solomon Asanté (Texoma) wins a free kick in the defensive half.,2025-03-19 04:54:57
13260,732265,116,44900940,80',"Corner, Texoma. Conceded by Thomas Robinson.",2025-03-19 04:54:57
13260,732265,117,44900945,81',Foul by Preston Kilwien (Texoma).,2025-03-19 04:54:57
13260,732265,118,44900945,81',Thomas Robinson (Foro) wins a free kick in the defensive half.,2025-03-19 04:54:57
13260,732265,119,-1,82',Delay in match because of an injury Will Perkins (Texoma).,2025-03-19 04:54:57
13260,732265,120,-1,84',Delay over. They are ready to continue.,2025-03-19 04:54:57
13260,732265,121,44900959,85',"Substitution, Texoma. Leland Gray replaces Will Perkins because of an injury.",2025-03-19 04:54:57
13260,732265,122,44900960,86',"Offside, Texoma. Diego Pepi is caught offside.",2025-03-19 04:54:57
13260,732265,123,44900975,87',Foul by Gibran Rayo (Foro).,2025-03-19 04:54:57
13260,732265,124,44900975,87',Lamin Jawneh (Texoma) wins a free kick in the defensive half.,2025-03-19 04:54:57
13260,732265,125,44900978,88',Fabricio Martinez (Foro) wins a free kick on the left wing.,2025-03-19 04:54:57
13260,732265,126,44900978,88',Foul by Reid Valentine (Texoma).,2025-03-19 04:54:57
13260,732265,127,44900979,88',Reid Valentine (Texoma) is shown the yellow card for a bad foul.,2025-03-19 04:54:57
13260,732265,128,44900983,88',"Offside, Foro. Rio Ramirez is caught offside.",2025-03-19 04:54:57
13260,732265,129,44900988,90',Foul by Angelo Calfo (Texoma).,2025-03-19 04:54:57
13260,732265,130,44900988,90',Gibran Rayo (Foro) wins a free kick on the right wing.,2025-03-19 04:54:57
13260,732265,131,44901051,90',Thomas Robinson (Foro) hits the right post with a with an attempt from very close range following a set piece situation.,2025-03-19 04:54:57
13260,732265,132,-1,90'+1',Fourth official has announced 5 minutes of added time.,2025-03-19 04:54:57
13260,732265,133,44901003,90'+2',Foul by McKinley Smith (Foro).,2025-03-19 04:54:57
13260,732265,134,44901003,90'+2',Lamin Jawneh (Texoma) wins a free kick on the left wing.,2025-03-19 04:54:57
13260,732265,135,44901013,90'+2',Attempt missed. Solomon Asanté (Texoma) header from the centre of the box is just a bit too high. Assisted by Lamin Jawneh with a cross.,2025-03-19 04:54:57
13260,732265,136,44901014,90'+3',Foul by Leland Gray (Texoma).,2025-03-19 04:54:57
