seasonType,eventId,commentaryOrder,playId,clockDisplayValue,commentaryText,updateDateTime
13259,734956,86,44980857,64',"Attempt missed. Jordan Skelton (One Knoxville) header from the centre of the box is close, but misses the top right corner. Assisted by Stuart Ritchie with a cross following a corner.",2025-04-04 04:58:14
13259,734956,87,44980882,65',Foul by Zane Bubb (Greenville Triumph).,2025-04-04 04:58:14
13259,734956,88,44980882,65',Mikkel Gøling (One Knoxville) wins a free kick in the attacking half.,2025-04-04 04:58:14
13259,734956,89,44980885,66',Attempt saved. Stuart Ritchie (One Knoxville) right footed shot from the centre of the box is saved in the centre of the goal. Assisted by Mikkel Gøling.,2025-04-04 04:58:14
13259,734956,90,44980886,66',Connor Evans (Greenville Triumph) wins a free kick on the left wing.,2025-04-04 04:58:14
13259,734956,91,44980886,66',Foul by Jaheim Brown (One Knoxville).,2025-04-04 04:58:14
13259,734956,92,44980928,67',"Substitution, One Knoxville. Babacar Diene replaces Kempes Tekiela.",2025-04-04 04:58:14
13259,734956,93,44980887,67',"Substitution, One Knoxville. Nicola Rosamilia replaces Stávros Zarokóstas.",2025-04-04 04:58:14
13259,734956,94,44980895,67',"Substitution, One Knoxville. Gio Calixtro replaces Mark Doyle.",2025-04-04 04:58:14
13259,734956,95,44980950,67',"Attempt missed. Chevone Marsh (Greenville Triumph) left footed shot from the left side of the box is close, but misses to the left following a set piece situation.",2025-04-04 04:58:14
13259,734956,96,44980930,69',Attempt blocked. Gio Calixtro (One Knoxville) right footed shot from a difficult angle on the left is blocked. Assisted by Nicola Rosamilia.,2025-04-04 04:58:14
13259,734956,97,44981240,72',Attempt missed. Ropapa Mensah (Greenville Triumph) header from the centre of the box misses to the right. Assisted by Evan Lee with a cross.,2025-04-04 04:58:14
13259,734956,98,44981020,72',"Corner, Greenville Triumph. Conceded by Stuart Ritchie.",2025-04-04 04:58:14
13259,734956,99,44981021,73',Foul by Ivan Agyaakwah (Greenville Triumph).,2025-04-04 04:58:14
13259,734956,100,44981021,73',Nicola Rosamilia (One Knoxville) wins a free kick in the defensive half.,2025-04-04 04:58:14
13259,734956,101,44981055,74',"Corner, One Knoxville. Conceded by Ivan Agyaakwah.",2025-04-04 04:58:14
13259,734956,102,44981100,75',Attempt blocked. Nicola Rosamilia (One Knoxville) right footed shot from the right side of the box is blocked. Assisted by Gio Calixtro with a cross.,2025-04-04 04:58:14
13259,734956,103,44981184,77',Attempt blocked. Evan Lee (Greenville Triumph) left footed shot from the left side of the box is blocked. Assisted by Connor Evans.,2025-04-04 04:58:14
13259,734956,104,-1,77',"Corner, Greenville Triumph. Conceded by Jordan Skelton.",2025-04-04 04:58:14
13259,734956,105,44981186,78',Attempt missed. Chevone Marsh (Greenville Triumph) left footed shot from outside the box is high and wide to the left following a corner.,2025-04-04 04:58:14
13259,734956,106,44981187,79',"Substitution, Greenville Triumph. Leonardo Castro replaces Chevone Marsh.",2025-04-04 04:58:14
13259,734956,107,-1,81',"Corner, Greenville Triumph. Conceded by Stuart Ritchie.",2025-04-04 04:58:14
13259,734956,108,44981305,81',Attempt missed. Zane Bubb (Greenville Triumph) header from the centre of the box misses to the left. Assisted by Connor Evans with a cross following a corner.,2025-04-04 04:58:14
13259,734956,109,-1,82',"Corner, Greenville Triumph. Conceded by Babacar Diene.",2025-04-04 04:58:14
13259,734956,110,44981242,82',Attempt missed. Chapa Herrera (Greenville Triumph) left footed shot from the left side of the box misses to the left. Assisted by Ivan Agyaakwah.,2025-04-04 04:58:14
13259,734956,111,-1,84',Delay in match because of an injury Mikkel Gøling (One Knoxville).,2025-04-04 04:58:14
13259,734956,112,-1,85',Delay over. They are ready to continue.,2025-04-04 04:58:14
13259,734956,113,44981373,85',Foul by Chapa Herrera (Greenville Triumph).,2025-04-04 04:58:14
13259,734956,114,44981373,85',Nicola Rosamilia (One Knoxville) wins a free kick in the defensive half.,2025-04-04 04:58:14
13259,734956,115,44981374,87',"Substitution, One Knoxville. Scott McLeod replaces Mikkel Gøling.",2025-04-04 04:58:14
13259,734956,116,44981397,88',"Corner, Greenville Triumph. Conceded by Jaheim Brown.",2025-04-04 04:58:14
13259,734956,117,44981444,89',"Corner, Greenville Triumph. Conceded by Babacar Diene.",2025-04-04 04:58:14
13259,734956,118,44981446,89',Attempt saved. Zane Bubb (Greenville Triumph) header from the centre of the box is saved in the centre of the goal. Assisted by Connor Evans with a cross.,2025-04-04 04:58:14
13259,734956,119,44981500,90',Sivert Haugli (One Knoxville) is shown the red card for violent conduct.,2025-04-04 04:58:14
13259,734956,120,-1,90'+1',Fourth official has announced 7 minutes of added time.,2025-04-04 04:58:14
13259,734956,121,-1,90'+3',Delay in match (One Knoxville).,2025-04-04 04:58:14
13259,734956,122,-1,90'+3',Delay in match because of an injury DJ Benton (Greenville Triumph).,2025-04-04 04:58:14
13259,734956,123,-1,90'+3',Delay over. They are ready to continue.,2025-04-04 04:58:14
13259,734956,124,44981591,90'+5',"Goal! Greenville Triumph 1, One Knoxville 3. Babacar Diene (One Knoxville) right footed shot from the left side of the six yard box to the bottom right corner. Assisted by Stuart Ritchie following a fast break.",2025-04-04 04:58:14
13259,734956,125,44981622,90'+7',Foul by Zane Bubb (Greenville Triumph).,2025-04-04 04:58:14
13259,734956,126,44981622,90'+7',Gio Calixtro (One Knoxville) wins a free kick on the left wing.,2025-04-04 04:58:14
13259,734956,127,44981657,90'+8',Evan Lee (Greenville Triumph) wins a free kick in the defensive half.,2025-04-04 04:58:14
13259,734956,128,44981657,90'+8',Foul by Gio Calixtro (One Knoxville).,2025-04-04 04:58:14
13259,734956,129,44981662,90'+8',Attempt blocked. Leonardo Castro (Greenville Triumph) right footed shot from the right side of the box is blocked. Assisted by Ropapa Mensah with a headed pass.,2025-04-04 04:58:14
13259,734956,130,-1,90'+8',"Second Half ends, Greenville Triumph 1, One Knoxville 3.",2025-04-04 04:58:14
13259,734956,131,-1,,"Match ends, Greenville Triumph 1, One Knoxville 3.",2025-04-04 04:58:14
13259,734957,0,-1,,Lineups are announced and players are warming up.,2025-04-04 04:58:14
13259,734957,1,44979961,,First Half begins.,2025-04-04 04:58:14
13259,734957,2,44979990,2',Foul by José Carrera-García (Forward Madison).,2025-04-04 04:58:14
13259,734957,3,44979990,2',Stefan Lukic (FC Tulsa) wins a free kick on the right wing.,2025-04-04 04:58:14
13259,734957,4,44980040,3',Foul by Delentz Pierre (FC Tulsa).,2025-04-04 04:58:14
13259,734957,5,44980040,3',Owen Finnerty (Forward Madison) wins a free kick in the defensive half.,2025-04-04 04:58:14
13259,734957,6,44980063,5',"Corner, FC Tulsa. Conceded by Timmy Mehl.",2025-04-04 04:58:14
13259,734957,7,44980116,7',Attempt saved. Garrett McLaughlin (Forward Madison) right footed shot from the centre of the box is saved in the bottom right corner. Assisted by Ferrety Sousa with a through ball.,2025-04-04 04:58:14
13259,734957,8,44980118,7',"Corner, Forward Madison. Conceded by Arthur Rogers.",2025-04-04 04:58:14
13259,734957,9,44980176,9',Attempt saved. Juan Galindrez (Forward Madison) right footed shot from the centre of the box is saved in the bottom left corner. Assisted by Ferrety Sousa.,2025-04-04 04:58:14
13259,734957,10,44980177,9',Attempt saved. Juan Galindrez (Forward Madison) right footed shot from the left side of the six yard box is saved in the bottom left corner.,2025-04-04 04:58:14
13259,734957,11,44980180,9',"Corner, Forward Madison. Conceded by Bryan Dowd.",2025-04-04 04:58:14
13259,734957,12,44980181,11',Foul by Juan Galindrez (Forward Madison).,2025-04-04 04:58:14
13259,734957,13,44980181,11',Lamar Batista (FC Tulsa) wins a free kick in the defensive half.,2025-04-04 04:58:14
13259,734957,14,44980248,12',Foul by Marcos Cerato (FC Tulsa).,2025-04-04 04:58:14
13259,734957,15,44980248,12',John Murphy (Forward Madison) wins a free kick in the defensive half.,2025-04-04 04:58:14
13259,734957,16,44980251,13',Hand ball by Taylor Calheira (FC Tulsa).,2025-04-04 04:58:14
13259,734957,17,44980309,16',Attempt blocked. Lamar Batista (FC Tulsa) left footed shot from outside the box is blocked.,2025-04-04 04:58:14
13259,734957,18,44980362,18',Attempt missed. Marcos Cerato (FC Tulsa) left footed shot from the centre of the box is too high.,2025-04-04 04:58:14
13259,734957,19,44980371,19',"Offside, FC Tulsa. Owen Damm is caught offside.",2025-04-04 04:58:14
13259,734957,20,44980414,21',"Goal! Forward Madison 0, FC Tulsa 1. Owen Damm (FC Tulsa) left footed shot from the centre of the box to the bottom right corner. Assisted by Taylor Calheira with a cross.",2025-04-04 04:58:14
13259,734957,21,-1,24',"Corner, Forward Madison. Conceded by Delentz Pierre.",2025-04-04 04:58:14
13259,734957,22,44980500,25',"Offside, Forward Madison. Juan Galindrez is caught offside.",2025-04-04 04:58:14
13259,734957,23,44980502,26',Foul by Giordano Colli (FC Tulsa).,2025-04-04 04:58:14
13259,734957,24,44980502,26',José Carrera-García (Forward Madison) wins a free kick in the defensive half.,2025-04-04 04:58:14
13259,734957,25,44980519,26',Attempt saved. Garrett McLaughlin (Forward Madison) header from the centre of the box is saved in the bottom left corner.,2025-04-04 04:58:14
13259,734957,26,44980522,28',Devin Boyce (Forward Madison) wins a free kick in the defensive half.,2025-04-04 04:58:14
13259,734957,27,44980522,28',Foul by Marcos Cerato (FC Tulsa).,2025-04-04 04:58:14
13259,734957,28,44980578,28',Attempt missed. Eddie Munjoma (Forward Madison) left footed shot from outside the box misses to the right. Assisted by Jake Crull with a through ball.,2025-04-04 04:58:14
13259,734957,29,44980543,30',Attempt missed. Nico Brown (Forward Madison) left footed shot from a difficult angle on the left is high and wide to the left. Assisted by Jake Crull.,2025-04-04 04:58:14
13259,734957,30,44980558,31',"Goal! Forward Madison 0, FC Tulsa 2. Kalil ElMedkhar (FC Tulsa) right footed shot from the centre of the box to the bottom right corner. Assisted by Stefan Lukic with a through ball.",2025-04-04 04:58:14
13259,734957,31,44980592,36',"Attempt missed. Juan Galindrez (Forward Madison) right footed shot from outside the box is close, but misses the top right corner. Assisted by John Murphy.",2025-04-04 04:58:14
13259,734957,32,44980612,38',Foul by Delentz Pierre (FC Tulsa).,2025-04-04 04:58:14
13259,734957,33,44980612,38',Juan Galindrez (Forward Madison) wins a free kick in the defensive half.,2025-04-04 04:58:14
13259,734957,34,44980613,38',Delentz Pierre (FC Tulsa) is shown the yellow card for a bad foul.,2025-04-04 04:58:14
13259,734957,35,44980615,39',Delentz Pierre (FC Tulsa) wins a free kick in the defensive half.,2025-04-04 04:58:14
13259,734957,36,44980615,39',Foul by Devin Boyce (Forward Madison).,2025-04-04 04:58:14
13259,734957,37,44980646,41',Attempt missed. Kalil ElMedkhar (FC Tulsa) left footed shot from the left side of the box is too high.,2025-04-04 04:58:14
13259,734957,38,44980692,44',Foul by José Carrera-García (Forward Madison).,2025-04-04 04:58:14
13259,734957,39,44980692,44',Giordano Colli (FC Tulsa) wins a free kick in the attacking half.,2025-04-04 04:58:14
13259,734957,40,44980714,45',Foul by Ferrety Sousa (Forward Madison).,2025-04-04 04:58:14
13259,734957,41,44980714,45',Taylor Calheira (FC Tulsa) wins a free kick on the left wing.,2025-04-04 04:58:14
13259,734957,42,-1,45'+1',Fourth official has announced 3 minutes of added time.,2025-04-04 04:58:14
13259,734957,43,44980758,45'+3',Foul by Stefan Lukic (FC Tulsa).,2025-04-04 04:58:14
13259,734957,44,44980758,45'+3',Garrett McLaughlin (Forward Madison) wins a free kick in the defensive half.,2025-04-04 04:58:14
13259,734957,45,44980759,45'+3',Stefan Lukic (FC Tulsa) is shown the yellow card for a bad foul.,2025-04-04 04:58:14
13259,734957,46,-1,45'+4',Delay in match because of an injury Garrett McLaughlin (Forward Madison).,2025-04-04 04:58:14
13259,734957,47,-1,45'+7',Delay over. They are ready to continue.,2025-04-04 04:58:14
13259,734957,48,44980812,45'+7',"Substitution, Forward Madison. Derek Gebhard replaces Garrett McLaughlin because of an injury.",2025-04-04 04:58:14
13259,734957,49,44980863,45'+10',"First Half ends, Forward Madison 0, FC Tulsa 2.",2025-04-04 04:58:14
13259,734957,50,44981158,45',"Second Half begins Forward Madison 0, FC Tulsa 2.",2025-04-04 04:58:14
13259,734957,51,44981159,45',"Substitution, Forward Madison. Aiden Mesias replaces Devin Boyce.",2025-04-04 04:58:14
13259,734957,52,44981160,46',Foul by Taylor Calheira (FC Tulsa).,2025-04-04 04:58:14
13259,734957,53,44981160,46',Timmy Mehl (Forward Madison) wins a free kick in the defensive half.,2025-04-04 04:58:14
13259,734957,54,44981174,47',Delentz Pierre (FC Tulsa) wins a free kick in the defensive half.,2025-04-04 04:58:14
13259,734957,55,44981174,47',Foul by Aiden Mesias (Forward Madison).,2025-04-04 04:58:14
13259,734957,56,44981711,48',Foul by Eddie Munjoma (Forward Madison).,2025-04-04 04:58:14
13259,734957,57,44981711,48',Taylor Calheira (FC Tulsa) wins a free kick in the attacking half.,2025-04-04 04:58:14
13259,734957,58,44981234,49',Foul by Owen Damm (FC Tulsa).,2025-04-04 04:58:14
13259,734957,59,44981234,49',Nico Brown (Forward Madison) wins a free kick in the attacking half.,2025-04-04 04:58:14
13259,734957,60,44981236,50',Foul by Timmy Mehl (Forward Madison).,2025-04-04 04:58:14
13259,734957,61,44981236,50',Taylor Calheira (FC Tulsa) wins a free kick in the attacking half.,2025-04-04 04:58:14
13259,734957,62,44981288,50',Penalty FC Tulsa. Taylor Calheira draws a foul in the penalty area.,2025-04-04 04:58:14
13259,734957,63,44981288,50',Penalty conceded by Owen Finnerty (Forward Madison) after a foul in the penalty area.,2025-04-04 04:58:14
13259,734957,64,44981290,51',"Goal! Forward Madison 0, FC Tulsa 3. Taylor Calheira (FC Tulsa) converts the penalty with a right footed shot to the bottom right corner.",2025-04-04 04:58:14
13259,734957,65,44981326,52',Foul by José Carrera-García (Forward Madison).,2025-04-04 04:58:14
13259,734957,66,44981326,52',Owen Damm (FC Tulsa) wins a free kick in the defensive half.,2025-04-04 04:58:14
13259,734957,67,44981416,55',Attempt blocked. Derek Gebhard (Forward Madison) right footed shot from the centre of the box is blocked.,2025-04-04 04:58:14
13259,734957,68,44981417,55',"Offside, Forward Madison. Juan Galindrez is caught offside.",2025-04-04 04:58:14
13259,734957,69,44981501,58',"Corner, FC Tulsa. Conceded by Timmy Mehl.",2025-04-04 04:58:14
13259,734957,70,44981502,58',Ferrety Sousa (Forward Madison) wins a free kick in the defensive half.,2025-04-04 04:58:14
13259,734957,71,44981502,58',Foul by Kalil ElMedkhar (FC Tulsa).,2025-04-04 04:58:14
13259,734957,72,44981503,58',Kalil ElMedkhar (FC Tulsa) is shown the yellow card for a bad foul.,2025-04-04 04:58:14
13259,734957,73,44981521,59',Eddie Munjoma (Forward Madison) wins a free kick on the left wing.,2025-04-04 04:58:14
13259,734957,74,44981521,59',Foul by Giordano Colli (FC Tulsa).,2025-04-04 04:58:14
13259,734957,75,44981541,61',"Offside, Forward Madison. Juan Galindrez is caught offside.",2025-04-04 04:58:14
13259,734957,76,44981637,62',Foul by Ferrety Sousa (Forward Madison).,2025-04-04 04:58:14
13259,734957,77,44981637,62',Taylor Calheira (FC Tulsa) wins a free kick in the attacking half.,2025-04-04 04:58:14
13259,734957,78,44981638,63',"Substitution, FC Tulsa. Boubacar Diallo replaces Stefan Lukic.",2025-04-04 04:58:14
13259,734957,79,44981639,63',"Substitution, FC Tulsa. Harvey St Clair replaces Owen Damm.",2025-04-04 04:58:14
13259,734957,80,44981640,63',"Substitution, FC Tulsa. Stefan Stojanovic replaces Kalil ElMedkhar.",2025-04-04 04:58:14
13259,734957,81,44981641,63',"Substitution, Forward Madison. Christopher Garcia replaces Nico Brown.",2025-04-04 04:58:14
13259,734957,82,44981642,64',"Substitution, Forward Madison. Nazeem Bartman replaces Ferrety Sousa.",2025-04-04 04:58:14
13259,734957,83,44981672,65',Attempt saved. Aiden Mesias (Forward Madison) right footed shot from the right side of the box is saved in the bottom left corner. Assisted by Nazeem Bartman.,2025-04-04 04:58:14
13259,734957,84,44981712,67',Foul by Marcos Cerato (FC Tulsa).,2025-04-04 04:58:14
13259,734957,85,44981712,67',Juan Galindrez (Forward Madison) wins a free kick in the attacking half.,2025-04-04 04:58:14
13259,734957,86,44981759,67',"Attempt missed. Timmy Mehl (Forward Madison) header from the right side of the six yard box is close, but misses to the left. Assisted by Jake Crull following a set piece situation.",2025-04-04 04:58:14
13259,734957,87,44981726,68',"Goal! Forward Madison 1, FC Tulsa 3. Nazeem Bartman (Forward Madison) header from very close range to the bottom left corner. Assisted by Timmy Mehl following a set piece situation.",2025-04-04 04:58:14
13259,734957,88,44981761,68',Foul by Stefan Stojanovic (FC Tulsa).,2025-04-04 04:58:14
13259,734957,89,44981761,68',Timmy Mehl (Forward Madison) wins a free kick in the defensive half.,2025-04-04 04:58:14
13259,734957,90,-1,69',Delay in match because of an injury Timmy Mehl (Forward Madison).,2025-04-04 04:58:14
13259,734957,91,-1,70',Delay over. They are ready to continue.,2025-04-04 04:58:14
13259,734957,92,-1,71',Delay in match (Forward Madison).,2025-04-04 04:58:14
13259,734957,93,-1,71',Delay over. They are ready to continue.,2025-04-04 04:58:14
13259,734957,94,44981785,72',Eddie Munjoma (Forward Madison) wins a free kick on the left wing.,2025-04-04 04:58:14
13259,734957,95,44981785,72',Foul by Boubacar Diallo (FC Tulsa).,2025-04-04 04:58:14
13259,734957,96,44981786,72',Boubacar Diallo (FC Tulsa) is shown the yellow card for a bad foul.,2025-04-04 04:58:14
13259,734957,97,44981821,73',Foul by Christopher Garcia (Forward Madison).,2025-04-04 04:58:14
13259,734957,98,44981821,73',Harvey St Clair (FC Tulsa) wins a free kick in the attacking half.,2025-04-04 04:58:14
13259,734957,99,44981841,74',Attempt blocked. Boubacar Diallo (FC Tulsa) left footed shot from the centre of the box is blocked. Assisted by Patrick Seagrist with a cross.,2025-04-04 04:58:14
13259,734957,100,44981872,75',"Offside, FC Tulsa. Harvey St Clair is caught offside.",2025-04-04 04:58:14
13259,734957,101,44981895,76',Foul by John Murphy (Forward Madison).,2025-04-04 04:58:14
13259,734957,102,44981895,76',Giordano Colli (FC Tulsa) wins a free kick in the defensive half.,2025-04-04 04:58:14
13259,734957,103,44981896,76',John Murphy (Forward Madison) is shown the yellow card for a bad foul.,2025-04-04 04:58:14
13259,734957,104,-1,76',Delay in match (Forward Madison).,2025-04-04 04:58:14
13259,734957,105,-1,77',Delay over. They are ready to continue.,2025-04-04 04:58:14
13259,734957,106,44981918,78',Attempt saved. Christopher Garcia (Forward Madison) left footed shot from a difficult angle on the left is saved in the centre of the goal. Assisted by Aiden Mesias.,2025-04-04 04:58:14
13259,734957,107,44981921,78',"Corner, Forward Madison. Conceded by Bryan Dowd.",2025-04-04 04:58:14
13259,734957,108,44981961,79',Attempt missed. Timmy Mehl (Forward Madison) header from the centre of the box is high and wide to the right. Assisted by José Carrera-García with a cross following a corner.,2025-04-04 04:58:14
13259,734957,109,44981991,80',Foul by John Murphy (Forward Madison).,2025-04-04 04:58:14
13259,734957,110,44981991,80',Lamar Batista (FC Tulsa) wins a free kick in the defensive half.,2025-04-04 04:58:14
13259,734957,111,44981963,80',"Offside, Forward Madison. Juan Galindrez is caught offside.",2025-04-04 04:58:14
13259,734957,112,-1,81',Delay in match (Forward Madison).,2025-04-04 04:58:14
13259,734957,113,44982003,82',"Substitution, FC Tulsa. Abdoulaye Cissoko replaces Delentz Pierre because of an injury.",2025-04-04 04:58:14
13259,734957,114,-1,82',Delay over. They are ready to continue.,2025-04-04 04:58:14
13259,734957,115,44982014,84',"Substitution, Forward Madison. Jackson Dietrich replaces John Murphy.",2025-04-04 04:58:14
13259,734957,116,44982019,86',"Attempt missed. Giordano Colli (FC Tulsa) right footed shot from the right side of the box is close, but misses to the right. Assisted by Boubacar Diallo following a fast break.",2025-04-04 04:58:14
13259,734957,117,44982032,88',Foul by Boubacar Diallo (FC Tulsa).,2025-04-04 04:58:14
13259,734957,118,44982032,88',José Carrera-García (Forward Madison) wins a free kick in the attacking half.,2025-04-04 04:58:14
13259,734957,119,44982042,88',Second yellow card to Boubacar Diallo (FC Tulsa) for a bad foul.,2025-04-04 04:58:14
13259,734957,120,44982052,89',Attempt missed. Derek Gebhard (Forward Madison) right footed shot from the centre of the box misses to the right.,2025-04-04 04:58:14
13259,734957,121,44982053,90',Foul by Jackson Dietrich (Forward Madison).,2025-04-04 04:58:14
13259,734957,122,44982053,90',Taylor Calheira (FC Tulsa) wins a free kick in the attacking half.,2025-04-04 04:58:14
13259,734957,123,-1,90'+1',Fourth official has announced 5 minutes of added time.,2025-04-04 04:58:14
13259,734957,124,44982059,90'+1',Christopher Garcia (Forward Madison) wins a free kick in the defensive half.,2025-04-04 04:58:14
13259,734957,125,44982059,90'+1',Foul by Harvey St Clair (FC Tulsa).,2025-04-04 04:58:14
13259,734957,126,44982068,90'+2',Foul by Aiden Mesias (Forward Madison).,2025-04-04 04:58:14
13259,734957,127,44982068,90'+2',Giordano Colli (FC Tulsa) wins a free kick in the defensive half.,2025-04-04 04:58:14
13259,734957,128,44982069,90'+2',Aiden Mesias (Forward Madison) is shown the yellow card.,2025-04-04 04:58:14
13259,734957,129,44982071,90'+3',Christopher Garcia (Forward Madison) wins a free kick in the defensive half.,2025-04-04 04:58:14
13259,734957,130,44982071,90'+3',Foul by Harvey St Clair (FC Tulsa).,2025-04-04 04:58:14
13259,734957,131,44982099,90'+5',Arthur Rogers (FC Tulsa) wins a free kick on the right wing.,2025-04-04 04:58:14
13259,734957,132,44982099,90'+5',Foul by Christopher Garcia (Forward Madison).,2025-04-04 04:58:14
13259,734957,133,44982100,90'+5',Christopher Garcia (Forward Madison) is shown the yellow card for a bad foul.,2025-04-04 04:58:14
13259,734957,134,-1,90'+6',"Second Half ends, Forward Madison 1, FC Tulsa 3.",2025-04-04 04:58:14
13259,734957,135,-1,,"Match ends, Forward Madison 1, FC Tulsa 3.",2025-04-04 04:58:14
13259,734958,0,-1,,Lineups are announced and players are warming up.,2025-04-04 04:58:14
13259,734958,1,-1,,First Half begins.,2025-04-04 04:58:14
13259,734958,2,44979980,1',"Goal! Naples 1, Little Rock Rangers 0. Jayden Onen (Naples) right footed shot from outside the box to the bottom right corner. Assisted by Kevin O'Connor.",2025-04-04 04:58:14
13259,734958,3,44980006,3',Foul by Caoimhin McConnell (Little Rock Rangers).,2025-04-04 04:58:14
13259,734958,4,44980006,3',Ian Cerro (Naples) wins a free kick in the defensive half.,2025-04-04 04:58:14
13259,734958,5,44980110,6',Foul by Julian Cisneros (Naples).,2025-04-04 04:58:14
13259,734958,6,44980110,6',Jon Coca (Little Rock Rangers) wins a free kick in the defensive half.,2025-04-04 04:58:14
13259,734958,7,44980139,7',"Attempt missed. Caoimhin McConnell (Little Rock Rangers) right footed shot from outside the box is close, but misses to the right.",2025-04-04 04:58:14
13259,734958,8,44980204,10',Foul by Carlos Beltran (Little Rock Rangers).,2025-04-04 04:58:14
13259,734958,9,44980204,10',Ian Cerro (Naples) wins a free kick in the attacking half.,2025-04-04 04:58:14
13259,734958,10,44980208,11',Attempt missed. Jayden Onen (Naples) right footed shot from outside the box is just a bit too high. Assisted by Luka Prpa.,2025-04-04 04:58:14
13259,734958,11,44980264,13',Attempt blocked. Julian Cisneros (Naples) right footed shot from outside the box is blocked.,2025-04-04 04:58:14
13259,734958,12,44980265,13',"Corner, Naples. Conceded by Alejandro Padilla.",2025-04-04 04:58:14
13259,734958,13,44980266,14',"Goal! Naples 2, Little Rock Rangers 0. Brecc Evans (Naples) header from very close range to the bottom right corner. Assisted by Luka Prpa with a cross following a corner.",2025-04-04 04:58:14
13259,734958,14,44980295,16',Carlos Beltran (Little Rock Rangers) wins a free kick in the defensive half.,2025-04-04 04:58:14
13259,734958,15,44980295,16',Foul by Jayden Onen (Naples).,2025-04-04 04:58:14
13259,734958,16,44980342,18',Foul by Roscoe Rubinstein (Naples).,2025-04-04 04:58:14
13259,734958,17,44980342,18',Gonzalo Carrasco (Little Rock Rangers) wins a free kick in the defensive half.,2025-04-04 04:58:14
13259,734958,18,44980373,18',Ethan Blake (Little Rock Rangers) wins a free kick on the left wing.,2025-04-04 04:58:14
13259,734958,19,44980373,18',Foul by Gustavo Fernandes (Naples).,2025-04-04 04:58:14
13259,734958,20,44980375,19',Attempt missed. Jon Coca (Little Rock Rangers) left footed shot from outside the box is high and wide to the left following a set piece situation.,2025-04-04 04:58:14
13259,734958,21,44980478,25',"Attempt missed. Kevin Ventura (Little Rock Rangers) header from the right side of the box is close, but misses to the right. Assisted by Steven Stone with a cross.",2025-04-04 04:58:14
13259,734958,22,44980525,27',Foul by Gonzalo Carrasco (Little Rock Rangers).,2025-04-04 04:58:14
13259,734958,23,44980525,27',Luka Prpa (Naples) wins a free kick in the defensive half.,2025-04-04 04:58:14
13259,734958,24,-1,30',"Corner, Naples. Conceded by Kevin Ventura.",2025-04-04 04:58:14
13259,734958,25,44980552,31',Alejandro Padilla (Little Rock Rangers) wins a free kick in the defensive half.,2025-04-04 04:58:14
13259,734958,26,44980552,31',Foul by Brecc Evans (Naples).,2025-04-04 04:58:14
13259,734958,27,44980565,31',Foul by Jon Coca (Little Rock Rangers).,2025-04-04 04:58:14
